"","X","nationality","tags","score","content","content_detail"
"525",525,"Switzerland","<U+2022> Leisure trip<U+2022> Family with young children<U+2022> Business King Room - Non-Smoking<U+2022> Stayed 1 night",9.2,"¡°Excellent check-in, great staff, rooms were side-by-side and...¡±"," Excellent check-in, great staff, rooms were side-by-side and connected, which was nice The rooms themselves are very nicely equipped, lovely bathroom, and comfy bed The only slight niggle is that the rooms smell a little musty I am sure the humidity in Singapore makes this a constant challenge, and that is my only concern Otherwise, I would HIGHLY recommend this hotel to anyone who has a stopover at Changi, and early morning flight out, or whatever The pool is unbelievably nice for an airport hotelStayed in August "
"526",526,"New Zealand","<U+2022> Leisure trip<U+2022> Couple<U+2022> Business King Room - Non-Smoking<U+2022> Stayed 1 night",8.8,"¡°Excellent stopover hotel, beautiful rooms¡±"," Spacious, modern roomsExcellent check in staff who ensured we got into our room as early as possibleStayed in July "
"527",527,"Malaysia","<U+2022> Leisure trip<U+2022> Family with young children<U+2022> Business King Room - Non-Smoking<U+2022> Stayed 1 night",8.3,"¡°Great hotel, friendly staff and good facilities all around the hotel.¡±","I don't quite like the connecting rooms provided because the connecting doors doesn't open fully, it will close back if you don't block it with some heavy stuff The rooms that facing the terminal has much better connecting rooms with door fully open I like the location which is at Terminal  I don't have to wake up early to catch my flight It's just walking distance away to the checkin counter If I want to go to the city, MRT station is also walking distance awayStayed in August "
"528",528,"Australia","<U+2022> Couple<U+2022> Business King Room - Non-Smoking<U+2022> Stayed 1 night<U+2022> Submitted via mobile",10,"¡°Totally suited to our requirements.¡±","No complaints Very convenient for overnight stay en route to Saigon Terminal train then walked around the corner to the hotel then reverse in the morning for onward flightJoined the ' club' and so had special offer buffet dinner and breakfast at very reasonable rateStayed in August "
"529",529,"Australia","<U+2022> Leisure trip<U+2022> Family with young children<U+2022> King Suite - Non-Smoking<U+2022> Stayed 1 night<U+2022> Submitted via mobile",8.3,"¡°Great staff support.¡±","Unable to access the second room due to maintainance View out of the windowStayed in August "
"530",530,"New Zealand","<U+2022> Leisure trip<U+2022> Couple<U+2022> Premier Double Room - Non-Smoking<U+2022> Stayed 1 night<U+2022> Submitted via mobile",10,"¡°Very nice¡±"," Unexpected stay due to airline delays Lovely hotel, staff very helpful and friendly One of the best buffet breakfasts we have ever hadStayed in August "
"531",531,"USA","<U+2022> Leisure trip<U+2022> Couple<U+2022> Premier Double Room - Non-Smoking<U+2022> Stayed 1 night",10,"¡°Accessibility.¡±"," Accessibility Services and accomodationsStayed in August "
"532",532,"South Africa","<U+2022> Leisure trip<U+2022> Couple<U+2022> Premier Double Room - Non-Smoking<U+2022> Stayed 1 night<U+2022> Submitted via mobile",9.6,"¡°Great. Very convenient. A life saver.¡±"," The bed was very comfortable and it was a great place to rest and take a shower before boarding our final flight back to South AfricaStayed in August "
"533",533,"Australia","<U+2022> Leisure trip<U+2022> Couple<U+2022> Business King Room - Non-Smoking<U+2022> Stayed 1 night<U+2022> Submitted via mobile",9.6,"¡°Free mobile phone to use during your stay¡±"," Free mobile phone to use during your stayStayed in August "
"534",534,"India","<U+2022> Business trip<U+2022> Solo traveller<U+2022> Premier Double Room - Non-Smoking<U+2022> Stayed 1 night",10,"¡°Excellent Airport Hotel¡±","Nothing to do around, no shops etc Connected to Airport, Very clean and large hotelStayed in July "
"535",535,"Singapore","<U+2022> Couple<U+2022> Premier Double Room - Non-Smoking<U+2022> Stayed 1 night",7.9,"¡°Great location for travellers¡±","The Air conditioner Felt the wind blowing onto the bed even though the fan speed had been adjusted to the lowestStayed in August "
"536",536,"France","<U+2022> Leisure trip<U+2022> Family with young children<U+2022> Business King Room - Non-Smoking<U+2022> Stayed 1 night<U+2022> Submitted via mobile",7.1,"¡°Close and convenient¡±","Pool closed at pm!As for the restaurants not ideal for an airport hotel Close and convenientStayed in August "
"537",537,"Australia","<U+2022> Leisure trip<U+2022> Couple<U+2022> Business King Room - Non-Smoking<U+2022> Stayed 1 night<U+2022> Submitted via mobile",10,"¡°Very relaxing and refreshing¡±","I would have preferred the mini fridge to be stocked Everything, especially the pillows on the bedStayed in August "
"538",538,"Australia","<U+2022> Leisure trip<U+2022> Couple<U+2022> Business King Room - Non-Smoking<U+2022> Stayed 1 night",8.8,"¡°We stayed at this property whilst in transit in Singapore.¡±","All good We stayed at this property whilst in transit in Singapore The property is ideally located for this overnight purpose We found the property very comfortable and convenient for an early morning departureStayed in August "
"539",539,"Japan","<U+2022> Leisure trip<U+2022> Solo traveller<U+2022> Premier Double Room - Non-Smoking<U+2022> Stayed 4 nights",9.2,"¡°The free handy phone in the room was terrific, having free...¡±","I always like a sauna or steam room, but the location made up for this The free handy phone in the room was terrific, having free international calls and internet that I could use in the room and even take with me all around Singapore was a huge helpThe room was big and modern with a super compfy bedThe sound proofing was first rate, in  days I oblivious to the fact I was sleeping above Terminal Also having a train station at your door was a big saving for meBuffet breakfast in western and Asian was hugeStayed in August "
"540",540,"Philippines","<U+2022> Leisure trip<U+2022> Group<U+2022> Business King Room - Non-Smoking<U+2022> Stayed 1 night<U+2022> Submitted via mobile",9.6,"¡°Awesome!¡±"," Sustainable designStayed in August "
"541",541,"Singapore","<U+2022> Leisure trip<U+2022> Couple<U+2022> Premier Double Room - Non-Smoking<U+2022> Stayed 1 night",5.8,"¡°Wouldnt come back again.¡±","Expensive car parking One of the few hotels that doesnt provide complimentary car parking Parking overnight costs $+SGD and thats like % of hotel room rate DisappointedIn room shower head squeaking like a rat and seems lowly maintained Aesthetically pleasingStayed in August "
"542",542,"New Zealand","<U+2022> Leisure trip<U+2022> Family with young children<U+2022> Business King Room - Non-Smoking<U+2022> Stayed 1 night<U+2022> Submitted via mobile",10,"¡°Great location. Someone that loves watching aircrafts great place. Accommodation fantastic.¡±","Nothing Great place Got upgraded to a larger room Huge rooms great viewsStayed in August "
"543",543,"Australia","<U+2022> Leisure trip<U+2022> Solo traveller<U+2022> Premier Double Room - Non-Smoking<U+2022> Stayed 1 night",6.3,"¡°1. Member of the public sleeping on lounge at entrance upon...¡±"," Member of the public sleeping on lounge at entrance upon arrival Reception staff were unfriendly Staff were disinterested in taking me to my room, despite multiple staff sitting around waiting for shift to end Beneath switches and across glass in bathroom were stains against the way I dread to think were caused fromStayed in August "
"544",544,"Singapore","<U+2022> Group<U+2022> Premier Double Room - Non-Smoking<U+2022> Stayed 1 night<U+2022> Submitted via mobile",10,"¡°Excellent¡±","Nothing in particular I had no breakfast thereStayed in July "
"545",545,"United Kingdom","<U+2022> Leisure trip<U+2022> Family with young children<U+2022> Business King Room - Non-Smoking<U+2022> Stayed 1 night<U+2022> Submitted via mobile",9.2,"¡°Wow - we will definitely return!¡±","The cocktail bar was not as swish as I  expected, but they served an excellent singapore sling! The room was excellent, overlooking the run way!  It was ultra modern, comfortable, very spacious and had everything you needed for an overnight stay  Our only regret was not stopping longerStayed in August "
"546",546,"Australia","<U+2022> Leisure trip<U+2022> Solo traveller<U+2022> Business King Room - Non-Smoking<U+2022> Stayed 1 night",7.9,"¡°Ultra-convenient Airport hotel¡±","Bit of a scrum at reception both times I went there Good standard for an airport hotel Location VERY handy!Stayed in August "
"547",547,"New Zealand","<U+2022> Leisure trip<U+2022> Couple<U+2022> Premier Double Room - Non-Smoking<U+2022> Stayed 1 night<U+2022> Submitted via mobile",9.6,"¡°Well positioned airport transit hotel.¡±","Get rid of the clock/radio!I did try turning the light down,but ended up unplugging it Well positioned airport transit hotelInternal access to all terminalsGreat variety for breakfastClean,comfortable and quiet roomStayed in August "
"548",548,"Australia","<U+2022> Leisure trip<U+2022> Group<U+2022> Business King Room - Non-Smoking<U+2022> Stayed 1 night<U+2022> Submitted via mobile",8.8,"¡°Extremely comfortable and convenient¡±"," Extremely comfortable and convenientStayed in August "
"549",549,"USA","<U+2022> Leisure trip<U+2022> Family with young children<U+2022> Business King Room - Non-Smoking<U+2022> Stayed 1 night",9.6,"¡°Super convenient location at the Airport in Singapore.¡±","The locations of the rooms are pretty spread out and sprawling Wouldn't stop me from staying here, just think it was a design flaw Super convenient location at the Airport in Singapore Food options were good Beautiful new hotelStayed in August "
"550",550,"Australia","<U+2022> Leisure trip<U+2022> Solo traveller<U+2022> Business King Room - Non-Smoking<U+2022> Stayed 1 night",7.9,"¡°Being an aviation buff, the view from the room was excellent.¡±","Reception staff seemed to be overwhelmed at times Being an aviation buff, the view from the room was excellentStayed in July "
"551",551,"Australia","<U+2022> Leisure trip<U+2022> Couple<U+2022> Business King Room - Non-Smoking<U+2022> Stayed 1 night",10,"¡°Lovely place to stay even overnight.¡±","It's not hotel's issue, but the construction (a part of the airport?) was going on in the view from the window Located just next to the terminal  Beautiful hotelStayed in August "
"552",552,"Australia","<U+2022> Leisure trip<U+2022> Solo traveller<U+2022> Business King Room - Non-Smoking<U+2022> Stayed 1 night<U+2022> Submitted via mobile",10,"¡°Great¡±","Nothing it was perfect Perfect environment for a stayStayed in August "
"553",553,"New Zealand","<U+2022> Group<U+2022> Deluxe Double or Twin Room<U+2022> Stayed 1 night<U+2022> Submitted via mobile",10,"¡°This was an awesome hotel to stay at if you want comfort and...¡±"," This was an awesome hotel to stay at if you want comfort and no hassles when spending a short time in SingaporeStayed in July "
"554",554,"Australia","<U+2022> Leisure trip<U+2022> Family with young children<U+2022> Business King Room - Non-Smoking<U+2022> Stayed 1 night<U+2022> Submitted via mobile",7.5,"¡°Enjoy my stay in this hotel¡±","The size of the room is small Staff are very friendly and convenient location for travellingStayed in July "
"555",555,"Indonesia","<U+2022> Group<U+2022> Premier Double Room - Non-Smoking<U+2022> Stayed 1 night<U+2022> Submitted via mobile",9,"¡°Good¡±","Didn't have a bidet spray Comfortable bed and pillows, the room  was very clean, the breakfast was amazing, easy to accessStayed in July "
"556",556,"Australia","<U+2022> Leisure trip<U+2022> Couple<U+2022> Business King Room - Non-Smoking<U+2022> Stayed 1 night<U+2022> Submitted via mobile",10,"¡°A great layover after a very long journey.¡±","Nothing's great layover Great breakfast  Lovely pool Very comfortable roomStayed in July "
"557",557,"Papua New Guinea","<U+2022> Business trip<U+2022> Couple<U+2022> 2 rooms<U+2022> Stayed 1 night<U+2022> Submitted via mobile",10,"¡°NA¡±","NA Excellent locationStayed in August "
"558",558,"United Kingdom","<U+2022> Leisure trip<U+2022> Family with young children<U+2022> Club Double Room - Non-Smoking<U+2022> Stayed 1 night",8.3,"¡°Convenience¡±","Our rooms (not all) far from lift and with many luggage items this a problem ConvenienceStayed in August "
"559",559,"Australia","<U+2022> Leisure trip<U+2022> Couple<U+2022> Business King Room - Non-Smoking<U+2022> Stayed 1 night",8.8,"¡°Large spacious room - very comfortable after a long flight.¡±"," Large spacious room - very comfortable after a long flightStayed in July "
"560",560,"Australia","<U+2022> Leisure trip<U+2022> Couple<U+2022> Deluxe Double or Twin Room<U+2022> Stayed 1 night<U+2022> Submitted via mobile",9.6,"¡°Great location to airport, would definitely stay here again¡±","Needed USB port for charging phone as didn't have adaptor,  but not a major issue Perfect location for late night arrivalsBreakfast at the restaurant is large variety and friendly staff Comfy pillows and bedStayed in July "
"561",561,"Australia","<U+2022> Leisure trip<U+2022> Couple<U+2022> Business King Room - Non-Smoking<U+2022> Stayed 1 night",7.5,"¡°On arrival (Terminal 3) the directions to the hotel are poor...¡±","On arrival (Terminal ) the directions to the hotel are poor as is the signage, for example, once in the lifts in the terminal the hotel is not listed as a floor option and the recommended route is overly long Having stayed the night you realise that the hotel is adjacent to the departure hall in terminal  and if you had taken the lift from the arrivals hall to the departure hall you would have saved yourself a few lift journeys and passageway routes following the odd signStayed in August "
"562",562,"Kuwait","<U+2022> Family with young children<U+2022> Business King Room - Non-Smoking<U+2022> Stayed 1 night<U+2022> Submitted via mobile",9.2,"¡°Location near airport 
¡±","Expensive Location near airport CleanStayed in August "
"563",563,"United Kingdom","<U+2022> Business trip<U+2022> Solo traveller<U+2022> Premier King Room with Pool View<U+2022> Stayed 1 night",9.6,"¡°Great place for changeover. Highly recommended.¡±","Too few staff at check in / out Always long queues Due to a very early flight, I took a chance at having breakfast at AM, and despite the fact that breakfast officially starts at AM, I was allowed in Very good breakfast And the outdoor pool is amazing, good for swimmers tooStayed in July "
"564",564,"USA","<U+2022> Leisure trip<U+2022> Solo traveller<U+2022> Business King Room - Non-Smoking<U+2022> Stayed 1 night",10,"¡°Exceeded expectations¡±"," Buffet, Room privacy, helpful staff fluent in EnglishStayed in July "
"565",565,"Australia","<U+2022> Leisure trip<U+2022> Family with young children<U+2022> Premier Double Room - Non-Smoking<U+2022> Stayed 1 night<U+2022> Submitted via mobile",8.8,"¡°Was excellent for our 9 hour transit stop¡±","Our room was a fair distance from the lifts and this was frustrating with our heavy bags and after a long flight That we could walk to the hotel from our terminalStayed in July "
"566",566,"New Zealand","<U+2022> Leisure trip<U+2022> Couple<U+2022> Business King Room - Non-Smoking<U+2022> Stayed 1 night<U+2022> Submitted via mobile",10,"¡°Great facilities beyond expectations¡±","Perfect Great facilities beyond expectationsStayed in August "
"567",567,"United Kingdom","<U+2022> Leisure trip<U+2022> Couple<U+2022> Business King Room - Non-Smoking<U+2022> Stayed 1 night",9.6,"¡°perfect location for Singapore airport¡±"," Very helpful staff and great cocktailsStayed in July "
"568",568,"Australia","<U+2022> Solo traveller<U+2022> Business King Room - Non-Smoking<U+2022> Stayed 1 night<U+2022> Submitted via mobile",10,"¡°Another fabulous stay¡±","I found the AC hard to change It read  degrees but was freezing I kept having to switch off  I love the  minute walk from terminal  and the generous early checkin and checkout I got  hours here for the price of  The lunch buffet is always outstanding and as long as you prepay just before the buffet they only charge  dollars for both days! Ie I only paid the once And the buffet is huge Seriously delicious for all tastes The pool is gorgeous with little palm islands Stayed in August "
"569",569,"Australia","<U+2022> Leisure trip<U+2022> Family with young children<U+2022> Premier Double Room - Non-Smoking<U+2022> Stayed 4 nights<U+2022> Submitted via mobile",10,"¡°Good for a quick stop over¡±"," All good Convenient location, good serviceStayed in July "
"570",570,"Austria","<U+2022> Business trip<U+2022> Solo traveller<U+2022> Premier Double Room - Non-Smoking<U+2022> Stayed 1 night",8.8,"¡°Great value (location, rooms etc)  if you need to stay...¡±"," Great value (location, rooms etc)  if you need to stay overnight at airportStayed in August "
"571",571,"Singapore","<U+2022> Family with young children<U+2022> Business King Room - Non-Smoking<U+2022> Stayed 1 night<U+2022> Submitted via mobile",9.6,"¡°Very nice hotel¡±","If have transport must pay for the parking feesshould be complimentary Very nice hotelStayed in July "
"572",572,"New Zealand","<U+2022> Leisure trip<U+2022> Solo traveller<U+2022> Business King Room - Non-Smoking<U+2022> Stayed 1 night<U+2022> Submitted via mobile",9.6,"¡°Great place to stay when on a stop over¡±"," Location and convenienceStayed in August "
"573",573,"Australia","<U+2022> Leisure trip<U+2022> Couple<U+2022> Business King Room - Non-Smoking<U+2022> Stayed 1 night<U+2022> Submitted via mobile",10,"¡°Overnight while in transit¡±"," Convenienceat the airportStayed in July "
"574",574,"United Kingdom","<U+2022> Leisure trip<U+2022> Solo traveller<U+2022> Business King Room - Non-Smoking<U+2022> Stayed 1 night<U+2022> Submitted via mobile",7.5,"¡°Air con in room wasn't on when I arrived so v hot.¡±"," Air con in room wasn't on when I arrived so v hot Room was decent size and clean but it is quite a hike between the room and all the other facilitiesStayed in August "
"575",575,"Singapore","<U+2022> Leisure trip<U+2022> Family with young children<U+2022> Premier Double Room - Non-Smoking<U+2022> Stayed 1 night<U+2022> Submitted via mobile",10,"¡°The bed the couch and the view¡±","Nothing that I don't like The bed the couch and the viewStayed in August "
"576",576,"Australia","<U+2022> Leisure trip<U+2022> Solo traveller<U+2022> Premier Double Room - Non-Smoking<U+2022> Stayed 1 night<U+2022> Submitted via mobile",8.8,"¡°Good hotel¡±","Check in service took long and staff could not find my booking at first place not enough staffs at check in counter Convenient, close to airport; clean and comfortableStayed in August "
"577",577,"Switzerland","<U+2022> Leisure trip<U+2022> Solo traveller<U+2022> Business King Room - Non-Smoking<U+2022> Stayed 1 night",8.8,"¡°Singapore stop over 2017.¡±"," A good hotel for a  stop over Situated in the airport which is approx  min from town Easy access directly from terminal  If you do not feel like eating or drinking at the hotel (which can be costly) there are numerous food stalls with reasonable prices in terminal Stayed in July "
"578",578,"New Zealand","<U+2022> Leisure trip<U+2022> Couple<U+2022> Business King Room - Non-Smoking<U+2022> Stayed 1 night",10,"¡°Great place to stay¡±"," Everything about this hotel was superb Clean, spacious, amenities perfect Great just to walk straight to your hotel from the terminal Certainly gets our vote for being the best hotel we have ever been in and we have travelled extensivelyStayed in August "
"579",579,"Singapore","<U+2022> Leisure trip<U+2022> Couple<U+2022> Premier Double Room - Non-Smoking<U+2022> Stayed 1 night",7.5,"¡°the room was spacious¡±","The staff at your club lounge they were not friendly because we are locals  but the Club Managers who checked us in was very helpful and friendly and accommodating  I cannot remember his name the room was spaciousStayed in July "
"580",580,"United Kingdom","<U+2022> Business trip<U+2022> Solo traveller<U+2022> Premier Double Room - Non-Smoking<U+2022> Stayed 1 night<U+2022> Submitted via mobile",9.6,"¡°Best airport hotel and more.¡±","There is no information from T to find the hotel Many other hotels have signage Price was significant But I guess sometimes you get what you pay for Room layout was nice, quality furniture, modern Scandinavian desk, Bluetooth small stereo, gourmet coffee machineStayed in August "
"581",581,"New Zealand","<U+2022> Leisure trip<U+2022> Couple<U+2022> Premier Double Room - Non-Smoking<U+2022> Stayed 1 night<U+2022> Submitted via mobile",10,"¡°Very well positioned for an early flight or a stopover.¡±","Nothing Very well positioned for an early flight or a stopoverCheckin was fast and efficient,rooms was quiet ,clean and comfortableBreakfast choices were goodWe really couldn't ask for anything more from an airport hotelStayed in August "
"582",582,"United Kingdom","<U+2022> Couple<U+2022> Business King Room - Non-Smoking<U+2022> Stayed 1 night",10,"¡°Fantastic hotel, right in the airport, very comfortable...¡±"," Fantastic hotel, right in the airport, very comfortable rooms, the staff also arranged rose petals and free dessert in the room as it was our honeymoonStayed in July "
"583",583,"Philippines","<U+2022> Leisure trip<U+2022> Couple<U+2022> Premier Double Room - Non-Smoking<U+2022> Stayed 1 night<U+2022> Submitted via mobile",10,"¡°Perfect!¡±","None Everything was amazing: location, facilities, comfort, value for money, service will definitely stay again the next time I have a long stopoverStayed in August "
"584",584,"Thailand","<U+2022> Leisure trip<U+2022> Solo traveller<U+2022> Business King Room - Non-Smoking<U+2022> Stayed 1 night<U+2022> Submitted via mobile",3.8,"¡°price no good¡±","I not like you systems because my room price came double what I see you baceStayed in August "
"585",585,"Kuwait","<U+2022> Leisure trip<U+2022> Couple<U+2022> Premier Double Room - Non-Smoking<U+2022> Stayed 3 nights",7.5,"¡°Amazing¡±","When we just entered the hotel the receptionist who greeted us was really rude Really Really Very Rude  We had called prior to arriving in Singapore to ask if an airport pick up was necessary as we had no idea that it was connecting with the hotel, they said it is near the airport and not connected to the airport or that we could walk through the airport to the hotel Then they just sent a guy to pick us at the arrivals and we walked with him till the reception firstly we were surprised and wondering why we didn't get a taxi after all the clarification over the phone  then when we reached the venue we were even more shocked to find out that they would be charging us for an airport pick up which didn't really happen The Receptionist at counter who received us was really rude and arguing that we have to pay even if we didn't use the service as we had booked The Matter is  we did not ""book"" this service we only inquired over the phone and they didn't mention that  it was in the airport itself and made us confirm to pick up from airport, which to us made no sense I loved the interior of this hotel and of our room the concept is brilliant Also I loved that the MRT is right downstairs everything was so convenient  Even their soap and shower gels smelt fantasticStayed in July "
"586",586,"United Kingdom","<U+2022> Group<U+2022> Business King Room - Non-Smoking<U+2022> Stayed 1 night<U+2022> Submitted via mobile",10,"¡°Fabulous one night  stay at Changi.¡±","Leaving We arrived late at night and because I am a wheelchair user and we were supposed to be given a room in a tower further away we were given an upgrade We were a group of   Our room was massive and situated right next to the pool The beds were so comfortable with luxurious soft cotton bedding The room included breakfast which was a feast, with a wide variety of food  Although we were only staying in thus hotel for one night and it was more expensive than the hotels we nirmally stay in, it was well worth the money and I would definitely stay again for a night The whole hotel was beautifully designed and accessed through Termibal  The best hotel I have ever experiencedStayed in August "
"587",587,"New Zealand","<U+2022> Leisure trip<U+2022> Couple<U+2022> Business King Room - Non-Smoking<U+2022> Stayed 1 night<U+2022> Submitted via mobile",9.2,"¡°Excellent transit stop and lovely room¡±","Only stayed one night as in transit to Vietnam Friendly staff and a special discount on the buffet dinner ($)Stayed in August "
"588",588,"Australia","<U+2022> Leisure trip<U+2022> Solo traveller<U+2022> Premier Double Room - Non-Smoking<U+2022> Stayed 1 night<U+2022> Submitted via mobile",8.8,"¡°Great location for an early flight with nice well appointed...¡±","Check in was a shambles with a really poorly designed area to line up for non VIP's it was everyone for them self when you realised everyone was pushing in and the staff didn't really notice or care about order  Great location for an early flight with nice well appointed and clean big rooms Stayed in July "
"589",589,"Australia","<U+2022> Leisure trip<U+2022> Couple<U+2022> Business King Room - Non-Smoking<U+2022> Stayed 2 nights",10,"¡°everything you could want exellent¡±"," everything you could want exellentStayed in August "
"590",590,"Ireland","<U+2022> Leisure trip<U+2022> Couple<U+2022> Premier King Room with Pool View<U+2022> Stayed 1 night",10,"¡°IT'S IN TERMINAL 3!!!¡±"," PERFECT LOCATION FOR AIRPORT LAYOVERS!Stayed in July "
