"","X","nationality","tags","score","content","content_detail"
"727",727,"United Kingdom","<U+2022> Leisure trip<U+2022> Family with young children<U+2022> Premier Double Room - Non-Smoking<U+2022> Stayed 1 night",6.3,"¡°Great Hotel, Rediculous opening hours at Restaurant.¡±","Have to clear a slow immigration took us  hours to get from the plane to the hotel and the restaurants close too early at pmStayed in July "
"728",728,"Australia","<U+2022> Leisure trip<U+2022> Family with young children<U+2022> Premier Double Room - Non-Smoking<U+2022> Stayed 1 night<U+2022> Submitted via mobile",9.6,"¡°Highly recommend for a comfortable and relaxing stay¡±","A spa bath as well as the pool It was a very comfortable room and surprisingly quiet considering we were at an international airportStayed in June "
"729",729,"Singapore","<U+2022> Leisure trip<U+2022> Couple<U+2022> Business King Room - Non-Smoking<U+2022> Stayed 1 night<U+2022> Submitted via mobile",10,"¡°A place to remember.a<U+009D>¡è¡±"," The view i got and the way the room was preparedand complimentary dessertsit was greatworth every pennyStayed in July "
"730",730,"Singapore","<U+2022> Leisure trip<U+2022> Family with young children<U+2022> Premier Double Room - Non-Smoking<U+2022> Stayed 1 night<U+2022> Submitted via mobile",6.7,"¡°The birthday cake for my Father is amazing<U+00EF><U+00BC><U+0081>¡±","No kids' swimming pool The birthday cake for my Father is amazing<U+EF><U+BC><U+>We are all so cutehappy for it<U+EF><U+BC><U+>Stayed in July "
"731",731,"Australia","<U+2022> Leisure trip<U+2022> Couple<U+2022> Business King Room - Non-Smoking<U+2022> Stayed 1 night",10,"¡°Great location and beautiful room¡±"," Great location, comfortable bed and nice bathroomStayed in July "
"732",732,"Australia","<U+2022> Leisure trip<U+2022> Family with young children<U+2022> Business King Room - Non-Smoking<U+2022> Stayed 1 night<U+2022> Submitted via mobile",10,"¡°Nearness to airport¡±"," Nearness to airportStayed in June "
"733",733,"Singapore","<U+2022> Leisure trip<U+2022> Solo traveller<U+2022> Business King Room - Non-Smoking<U+2022> Stayed 1 night",8.3,"¡°can be better¡±","Took long time to check in Booked two rooms but the staff assisted for the check in process asked me to wait at the lobby for the second room to be ready Waited at the lobby for more than half an hour and no one came to us I approached another staff to check on the status and the room was not ready by then Was asked to wait in the first room given The key for the second room only came more than an hour later The pillows or the pillow cases had unpleasant smell Not sure if they were changed Slept without pillow for the night The room is spacious and the location is goodStayed in June "
"734",734,"New Zealand","<U+2022> Leisure trip<U+2022> Couple<U+2022> Business King Room - Non-Smoking<U+2022> Stayed 2 nights<U+2022> Submitted via mobile",10,"¡°Great place to stay.¡±","Nothing Everything was very good Great location Very good hotel Idea for a travel overstay Staff accommodatingStayed in June "
"735",735,"Australia","<U+2022> Leisure trip<U+2022> Couple<U+2022> Business King Room - Non-Smoking<U+2022> Stayed 1 night",10,"¡°Perfect place to stay for a Singapore stopover - easy access from all terminals.¡±","Nothing Great room & bathroom Delicious breakfast (and we've had a few in the past  months!)We were upgraded at check in and the room had a lovely roof garden outside the windowVery quiet tooStayed in June "
"736",736,"Australia","<U+2022> Leisure trip<U+2022> Couple<U+2022> Business King Room - Non-Smoking<U+2022> Stayed 1 night",7.9,"¡°Convenient¡±","Bar and restaurant soul-less comfortable roomStayed in July "
"737",737,"Australia","<U+2022> Leisure trip<U+2022> Family with young children<U+2022> Business King Room - Non-Smoking<U+2022> Stayed 1 night<U+2022> Submitted via mobile",10,"¡°Rooms were fantastic, great facilities and breakfast was 10...¡±"," Rooms were fantastic, great facilities and breakfast was  star was amazing!!Stayed in July "
"738",738,"Philippines","<U+2022> Leisure trip<U+2022> Family with young children<U+2022> Business King Room - Non-Smoking<U+2022> Stayed 2 nights",10,"¡°excellent hotel and location for tourist¡±","nothing smoking room availability and efficiency of the hotel employeesStayed in July "
"739",739,"Indonesia","<U+2022> Leisure trip<U+2022> Family with young children<U+2022> Business King Room - Non-Smoking<U+2022> Stayed 1 night<U+2022> Submitted via mobile",9.2,"¡°Nice , good service and recommended¡±"," Dorset have very good service at the bus shuttle and nice room although first I walked in not so clean but the next day they have make up my rooms as requested, we hope to be back there againStayed in June "
"740",740,"Indonesia","<U+2022> Leisure trip<U+2022> Family with young children<U+2022> Premier King Room with Pool View<U+2022> Stayed 1 night<U+2022> Submitted via mobile",10,"¡°Very good service and beautiful room¡±"," Very good service and beautiful roomStayed in July "
"741",741,"Australia","<U+2022> Leisure trip<U+2022> Family with young children<U+2022> Business King Room - Non-Smoking<U+2022> Stayed 1 night<U+2022> Submitted via mobile",10,"¡°Great hotel¡±","None Next to airport and comfortable Stayed in July "
"742",742,"Australia","<U+2022> Leisure trip<U+2022> Solo traveller<U+2022> Business King Room - Non-Smoking<U+2022> Stayed 1 night<U+2022> Submitted via mobile",9.6,"¡°Luxury oasis in the airport¡±","Nothing Convenience from airport, efficient staff, clean, extremely comfortable quiet roomStayed in July "
"743",743,"Malaysia","<U+2022> Business trip<U+2022> Solo traveller<U+2022> Business King Room - Non-Smoking<U+2022> Stayed 1 night<U+2022> Submitted via mobile",7.5,"¡°Narrow but more than enough to stay as business trip¡±"," Narrow but more than enough to stay as business tripStayed in July "
"744",744,"Australia","<U+2022> Leisure trip<U+2022> Solo traveller<U+2022> Business King Room - Non-Smoking<U+2022> Stayed 1 night<U+2022> Submitted via mobile",10,"¡°Lovely easy airport stay¡±"," Great variety breakfast buffet Very tasty and great quality Room was super clean and well maintainedStayed in July "
"745",745,"Singapore","<U+2022> Leisure trip<U+2022> Group<U+2022> Premier Double Room - Non-Smoking<U+2022> Stayed 1 night",10,"¡°nice hotel,nice view and pool¡±","notting to say nice hotel,nice view and poolStayed in July "
"746",746,"Indonesia","<U+2022> Leisure trip<U+2022> Group<U+2022> Business King Room - Non-Smoking<U+2022> Stayed 1 night<U+2022> Submitted via mobile",8.8,"¡°the room¡±"," the roomStayed in June "
"747",747,"USA","<U+2022> Leisure trip<U+2022> Couple<U+2022> Premier Double Room - Non-Smoking<U+2022> Stayed 3 nights",8.8,"¡°welcoming staff¡±"," welcoming staffStayed in June "
"748",748,"New Zealand","<U+2022> Leisure trip<U+2022> Solo traveller<U+2022> Business King Room - Non-Smoking<U+2022> Stayed 1 night<U+2022> Submitted via mobile",10,"¡°Everything¡±"," EverythingStayed in June "
"749",749,"Australia","<U+2022> Leisure trip<U+2022> Couple<U+2022> Business King Room - Non-Smoking<U+2022> Stayed 1 night<U+2022> Submitted via mobile",9.6,"¡°Excellent overnight stop¡±"," Great staff and serviceStayed in June "
"750",750,"Singapore","<U+2022> Leisure trip<U+2022> Solo traveller<U+2022> Business King Room - Non-Smoking<U+2022> Stayed 2 nights<U+2022> Submitted via mobile",9.6,"¡°Weekend staycation¡±","A minor point - Breakfast not included , as told when I checked in This is strange cox I had the information from bookingcom that breakfast is included If The privacy blinds in the bathroom could be modified to let in a  Little light or scenery at the TOP, that would be betterStayed in June "
"751",751,"Singapore","<U+2022> Leisure trip<U+2022> Family with young children<U+2022> Business King Room - Non-Smoking<U+2022> Stayed 1 night<U+2022> Submitted via mobile",10,"¡°Nil¡±"," NilStayed in June "
"752",752,"Australia","<U+2022> Business trip<U+2022> Solo traveller<U+2022> Business King Room - Non-Smoking<U+2022> Stayed 1 night<U+2022> Submitted via mobile",8.3,"¡°Over priced for a short stay¡±"," Over priced for a short stayStayed in June "
"753",753,"Singapore","<U+2022> Leisure trip<U+2022> Solo traveller<U+2022> Business King Room - Non-Smoking<U+2022> Stayed 2 nights<U+2022> Submitted via mobile",8.3,"¡°Beautiful tub, privacy screen, shade control, air play,...¡±","I prefer the bed closer to the window Beautiful tub, privacy screen, shade control, air play, speakers in the bathroomStayed in June "
"754",754,"USA","<U+2022> Leisure trip<U+2022> Couple<U+2022> Business King Room - Non-Smoking<U+2022> Stayed 1 night<U+2022> Submitted via mobile",10,"¡°It's so easy to stay at the airport inbetween flights.¡±","Nothing  Great hotel located in the terminal at the airportStayed in June "
"755",755,"New Zealand","<U+2022> Leisure trip<U+2022> Couple<U+2022> Business King Room - Non-Smoking<U+2022> Stayed 1 night<U+2022> Submitted via mobile",9.6,"¡°Stopover on long haul flight¡±"," Great location and friendly helpful staffStayed in June "
"756",756,"Australia","<U+2022> Leisure trip<U+2022> Family with young children<U+2022> Business King Room - Non-Smoking<U+2022> Stayed 1 night<U+2022> Submitted via mobile",7.9,"¡°Comfy bed¡±"," Comfy bedStayed in June "
"757",757,"Malaysia","<U+2022> Couple<U+2022> Business King Room - Non-Smoking<U+2022> Stayed 1 night<U+2022> Submitted via mobile",10,"¡°Comfortable¡±","Swimming pool Everything is niceStayed in June "
"758",758,"Australia","<U+2022> Leisure trip<U+2022> Couple<U+2022> Business King Room - Non-Smoking<U+2022> Stayed 2 nights",9.2,"¡°Great Stopover spot¡±"," Great location to stop at on when traveling overseas The big beds are so comfortable and great pillows Facilities are excellent , such as club lounge and swimming pool Quiet room considering very busy locationStayed in June "
"759",759,"Indonesia","<U+2022> Family with young children<U+2022> Business King Room - Non-Smoking<U+2022> Stayed 1 night<U+2022> Submitted via mobile",9.6,"¡°A nice hotel¡±"," The hotel looks nice, clean and modern Everything is comfortableStayed in June "
"760",760,"Australia","<U+2022> Leisure trip<U+2022> Solo traveller<U+2022> Business King Room - Non-Smoking<U+2022> Stayed 1 night<U+2022> Submitted via mobile",10,"¡°It was a great stay¡±"," Fantastic service and great facilitiesStayed in June "
"761",761,"Australia","<U+2022> Business trip<U+2022> Solo traveller<U+2022> Premier Double Room - Non-Smoking<U+2022> Stayed 1 night",9.6,"¡°Rooms are stunning and so well stocked with all the lovely...¡±","Would have loved more vegan options at the buffet :) Rooms are stunning and so well stocked with all the lovely little things that make a stay so convenient The room service was phenomenal!Stayed in June "
"762",762,"Singapore","<U+2022> Leisure trip<U+2022> Couple<U+2022> Business King Room - Non-Smoking<U+2022> Stayed 1 night",10,"¡°Room and location of hotel = Good¡±","The walkway to get to the lift to get to our room was unnecessary long, and dimly-lighted Room was just beautiful, bed was really comfortable that you'd fall asleep the minute you lie down on it Hotel is located right beside the skytrain, which made it so much easier to travel aroundStayed in June "
"763",763,"Singapore","<U+2022> Leisure trip<U+2022> Family with young children<U+2022> King Suite - Non-Smoking<U+2022> Stayed 1 night<U+2022> Submitted via mobile",10,"¡°Great stay!¡±"," Room was spacious and niceStayed in June "
"764",764,"New Zealand","<U+2022> Leisure trip<U+2022> Couple<U+2022> Deluxe Double or Twin Room<U+2022> Stayed 1 night<U+2022> Submitted via mobile",9.6,"¡°Room and breakfast top class¡±","Check in and check out was quite slow but then I believe it was a holiday weekend and staff were stretched Room and breakfast top classStayed in June "
"765",765,"Japan","<U+2022> Leisure trip<U+2022> Couple<U+2022> Business King Room - Non-Smoking<U+2022> Stayed 1 night<U+2022> Submitted via mobile",7.5,"¡°Toilet flush¡±","Toilet flushStayed in May "
"766",766,"Singapore","<U+2022> Leisure trip<U+2022> Family with young children<U+2022> Business King Room - Non-Smoking<U+2022> Stayed 1 night<U+2022> Submitted via mobile",6.7,"¡°Great disappointment though hotel facilities are great¡±","Overall the stay was a very satisfied one until I went home and discovered I left my child's favourite soft toys in the room I called up the hotel immediately and asked for help, Hoping to retrieve them back A staff named Jocelyn answered the call and said hotel will get back to me with regards to this To my great disappointment, being a  star hotel, I didn't get any answer at the end of the day I m prepared not able to get back the toys but I expect a courtesy call to at least tell me whether or not they found the soft toys (which is important to my child)  I have actually stayed at this hotel for more than twice but this incident has greatly disappoint me Accede to my request for giving me a room that is near to the lift The bed is comfortable The bath tub is bigStayed in June "
"767",767,"Australia","<U+2022> Leisure trip<U+2022> Couple<U+2022> Premier Double Room - Non-Smoking<U+2022> Stayed 1 night<U+2022> Submitted via mobile",9.6,"¡°The place to stay when in transit¡±","The bed was hardStayed in June "
"768",768,"Australia","<U+2022> Leisure trip<U+2022> Group<U+2022> Deluxe Double Room Non-Smoking<U+2022> Stayed 1 night<U+2022> Submitted via mobile",9.2,"¡°Ideal location¡±","Nothing Excellent room upgradeStayed in June "
"769",769,"Australia","<U+2022> Leisure trip<U+2022> Couple<U+2022> Business King Room - Non-Smoking<U+2022> Stayed 1 night",10,"¡°I love everything about this hotel¡±"," The Hotel is an oasis at the busy Singapore Changi Airport Brilliant check-in, thanks to Warren and his attention to detail as our daughter arrived  hours after us - in the early morning - and was given a room across the hall Comfortable quiet room, charming Chinese dinner and punctual wake up call  The swimming pool is an outstanding  featureStayed in June "
"770",770,"USA","<U+2022> Leisure trip<U+2022> Solo traveller<U+2022> Business King Room - Non-Smoking<U+2022> Stayed 1 night",6.3,"¡°Looks nice, modern and chic.¡±","I am not convinced this is good value for the money  The concierge was not very helpful, hard to set wake up call  A little too pricy Looks nice, modern and chic  Location is the selling point  Gym was reasonably goodStayed in June "
"771",771,"Indonesia","<U+2022> Leisure trip<U+2022> Family with young children<U+2022> Business King Room - Non-Smoking<U+2022> Stayed 1 night<U+2022> Submitted via mobile",6.3,"¡°Stylish and clean hotel with easy access at Changi airport¡±","Check in is confusing, and less staff at concierge to attend guests Price a bit high too Clean room and easy access from Changi airportStayed in June "
"772",772,"Australia","<U+2022> Leisure trip<U+2022> Couple<U+2022> Business King Room - Non-Smoking<U+2022> Stayed 2 nights<U+2022> Submitted via mobile",7.9,"¡°Location¡±"," LocationStayed in June "
"773",773,"Australia","<U+2022> Leisure trip<U+2022> Couple<U+2022> Business King Room - Non-Smoking<U+2022> Stayed 1 night<U+2022> Submitted via mobile",9.6,"¡°Our Transit Stay at Crown Plaza Singapore¡±"," Very conveniently located  Very clean and comfortableStayed in June "
"774",774,"New Zealand","<U+2022> Business trip<U+2022> Solo traveller<U+2022> Business King Room - Non-Smoking<U+2022> Stayed 1 night",7.9,"¡°Their promised receipts to be sent by email never came¡±","Their promised receipts to be sent by email never cameStayed in June "
"775",775,"Germany","<U+2022> Leisure trip<U+2022> Couple<U+2022> Business King Room - Non-Smoking<U+2022> Stayed 1 night<U+2022> Submitted via mobile",8.8,"¡°Anonymous flaire¡±","Got an email with a special dinner offer, tried to book it right away and it was already sold out!!!Nobody helped us with the luggage or led us to the room Comfy beds, yummy breakfastStayed in June "
"776",776,"China","<U+2022> Business trip<U+2022> Solo traveller<U+2022> Business King Room - Non-Smoking<U+2022> Stayed 1 night",10,"¡°Perfect to stay there.¡±"," Perfect to stay there Bar is awesome with friendly stuff Breakfast is goood!Stayed in June "
"777",777,"United Kingdom","<U+2022> Leisure trip<U+2022> Solo traveller<U+2022> Business King Room - Non-Smoking<U+2022> Stayed 1 night",10,"¡°The room was modern, the bed was smart and well presented.¡±","I reported when I checked out the floor was very dirty, the carpet had scraps of things all over it !!   :(     I picked up a lot and put them into the bin   When I plugged in my computer cord behind the bed side tablethere was piles of dust on all of the cords already there, and more stuff on the carpet behind the bedside table :(    The bathroom floor was very cleanbut the main room carpet was not cleaned at all  The mirror when light was turned onshowed dust all over the surface  :( The room was modern, the bed was smart and well presented  The Bathroom was excellent, thank goodness for the privacy screen for when I was in there,  there was a giant and very "" Man Intensive"" building site outside my window !!!   Interesting for a couple of minutes, and could see and certainly see planes taking off in the distancethe room rumbled and was noisy for a minute  Thank goodness for the bathroom door that shut out the extra noise  :)    Staff at check-in excellent and patient, and friendlyStayed in June "
"778",778,"Australia","<U+2022> Leisure trip<U+2022> Solo traveller<U+2022> Business King Room - Non-Smoking<U+2022> Stayed 1 night<U+2022> Submitted via mobile",9.6,"¡°Helpful staff and convenient location¡±"," Helpful staff and convenient locationStayed in June "
"779",779,"USA","<U+2022> Leisure trip<U+2022> Family with young children<U+2022> Business King Room - Non-Smoking<U+2022> Stayed 1 night<U+2022> Submitted via mobile",10,"¡°Great hotel so close to the airport¡±","None Convenient, hotel rooms, cleanlinessStayed in June "
"780",780,"Australia","<U+2022> Leisure trip<U+2022> Couple<U+2022> Business King Room - Non-Smoking<U+2022> Stayed 1 night<U+2022> Submitted via mobile",8.8,"¡°Convenient and nice for stop over at Changi¡±","When we checked in, we were told that the buffet breakfast was fully booked and we should go outside Terminal  to find food at a cafe!! I find it hard to believe that any hotel would not be able to offer a meal in a restaurant to guests staying at their hotel! Convenient and nice for stop over at ChangiStayed in June "
"781",781,"United Kingdom","<U+2022> Leisure trip<U+2022> Solo traveller<U+2022> Business King Room - Non-Smoking<U+2022> Stayed 1 night",8.8,"¡°Just convenient and efficient - apart from relatively long...¡±","Checking in and out a bit slow Just convenient and efficient - apart from relatively long waits to check-in and outStayed in May "
"782",782,"New Zealand","<U+2022> Business trip<U+2022> Solo traveller<U+2022> Business King Room - Non-Smoking<U+2022> Stayed 1 night<U+2022> Submitted via mobile",9.6,"¡°So close and easy to deal with.¡±"," So close and easy to deal with Helpful staffStayed in May "
"783",783,"USA","<U+2022> Leisure trip<U+2022> Couple<U+2022> Business King Room - Non-Smoking<U+2022> Stayed 1 night",10,"¡°Would definitely stay there again if in Singapore.  Very convenient to all terminals.¡±","We didn't have time to eat breakfast, which was included, as our flight was too tight time wise  I asked for a box breakfast to go, but front desk felt we had enough time to get to the correct terminal and check in  We didn't The bed was super comfortable  Room was nice, clean  with plenty of room  and a nice viewStayed in June "
"784",784,"Japan","<U+2022> Business trip<U+2022> Solo traveller<U+2022> Business King Room - Non-Smoking<U+2022> Stayed 1 night",9.6,"¡°One night at Singapore airport¡±"," Great location if you stay at Singapore airport, less than  minutes walk from any terminal Nice, quiet room, you cannot hear the planes Also got a free ride on the hotel's shuttle bus next morningStayed in June "
"785",785,"New Zealand","<U+2022> Couple<U+2022> Deluxe Double Room Non-Smoking<U+2022> Stayed 2 nights",10,"¡°Excellent Stopover Hotel for quiet restfull sleep.¡±","Long walk from Aircraft Friendly check-in staff, luxury sheets, quiet room, in room facilities Great relaxing stop-overStayed in June "
"786",786,"USA","<U+2022> Leisure trip<U+2022> Couple<U+2022> Business King Room - Non-Smoking<U+2022> Stayed 1 night<U+2022> Submitted via mobile",10,"¡°Enjoyable stay.¡±","Easier access to the business center!  We needed a special request and a person to enter and use the computer for confirming and printing boarding passes - NOT a desirable approach Computer for booking purposes should be readily available in the lobby We were delighted with the room amenities and the firm King bed!Stayed in June "
"787",787,"Australia","<U+2022> Leisure trip<U+2022> Family with young children<U+2022> Business King Room - Non-Smoking<U+2022> Stayed 1 night",10,"¡°I loved the layout and finishing touches of the Hotel.¡±","I can't say there was a downside my entire family had a great time I loved the layout and finishing touches of the Hotel It was modern and comfortable with all of the facilities you would expect and the staff went out of their way for you Great experience and looking forward to staying there againStayed in June "
"788",788,"Hong Kong","<U+2022> Solo traveller<U+2022> Business King Room - Non-Smoking<U+2022> Stayed 1 night<U+2022> Submitted via mobile",9.6,"¡°Good transit hotel¡±"," In the airportStayed in June "
"789",789,"United Kingdom","<U+2022> Leisure trip<U+2022> Couple<U+2022> Business King Room - Non-Smoking<U+2022> Stayed 1 night<U+2022> Submitted via mobile",9.2,"¡°Location¡±","Nothing really, was a short stay to catch next flight LocationStayed in June "
"790",790,"Singapore","<U+2022> Leisure trip<U+2022> Couple<U+2022> Business King Room - Non-Smoking<U+2022> Stayed 1 night<U+2022> Submitted via mobile",9.6,"¡°Spacious room¡±","Restaurant too dark No natural sunlight even during day time Spacious roomStayed in May "
"791",791,"Singapore","<U+2022> Leisure trip<U+2022> Couple<U+2022> Business King Room - Non-Smoking<U+2022> Stayed 1 night<U+2022> Submitted via mobile",9.6,"¡°Good staycation experience¡±","The swimming pool had jacuzzi jets but were not working at all Clean rooms, big toilet, great breakfast buffetStayed in June "
"792",792,"Singapore","<U+2022> Leisure trip<U+2022> Group<U+2022> Premier Double Room - Non-Smoking<U+2022> Stayed 1 night",7.5,"¡°RUNWAY VIEW¡±","BATH ROOM DOOR SPOIL RUNWAY VIEWStayed in June "
"793",793,"Hong Kong","<U+2022> Leisure trip<U+2022> Solo traveller<U+2022> Business King Room - Non-Smoking<U+2022> Stayed 1 night<U+2022> Submitted via mobile",7.5,"¡°Perfect between 2 flights¡±","Nothing In the airport Very good when you arrive very very early morning and leave during the nightStayed in June "
"794",794,"Singapore","<U+2022> Leisure trip<U+2022> Family with young children<U+2022> Business King Room - Non-Smoking<U+2022> Stayed 1 night",7.1,"¡°The bed is too soft.¡±","The bed is too softStayed in June "
"795",795,"Singapore","<U+2022> Leisure trip<U+2022> Family with young children<U+2022> King Suite - Non-Smoking<U+2022> Stayed 1 night<U+2022> Submitted via mobile",9.6,"¡°Location and spacious area¡±"," Location and spacious areaStayed in June "
"796",796,"USA","<U+2022> Leisure trip<U+2022> Couple<U+2022> Business King Room - Non-Smoking<U+2022> Stayed 1 night<U+2022> Submitted via mobile",10,"¡°Everything¡±","Nothing EverythingStayed in June "
"797",797,"Australia","<U+2022> Business trip<U+2022> Solo traveller<U+2022> Premier Double Room - Non-Smoking<U+2022> Stayed 1 night<U+2022> Submitted via mobile",9.6,"¡°Easier than travelling into the city for a one night stopover¡±","Better signage in the airport Requested hot oatmeal and received it, loved all the little touches, the fruit etcStayed in June "
"798",798,"Australia","<U+2022> Leisure trip<U+2022> Couple<U+2022> Premier Double Room - Non-Smoking<U+2022> Stayed 1 night<U+2022> Submitted via mobile",8.3,"¡°Lovely hotel¡±"," Lovely hotel, great place to stay between flights, shame we weren't there long enough to enjoy the facilities, good breakfastStayed in May "
"799",799,"Indonesia","<U+2022> Leisure trip<U+2022> Family with young children<U+2022> Deluxe Double Room Non-Smoking<U+2022> Stayed 1 night<U+2022> Submitted via mobile",8.8,"¡°Reception was very kind and helpful. Breakfast very good¡±","The price Everything is superb except the priceStayed in June "
"800",800,"USA","<U+2022> Leisure trip<U+2022> Couple<U+2022> Business King Room - Non-Smoking<U+2022> Stayed 1 night<U+2022> Submitted via mobile",9.5,"¡°Great airport location.  Especially welcoming after a late arrival.¡±","Not a thing So nice to access the hotel after a :am arrival into Changi  Beds super comfortable and staff welcomingStayed in June "
"801",801,"New Zealand","<U+2022> Leisure trip<U+2022> Couple<U+2022> Business King Room - Non-Smoking<U+2022> Stayed 1 night",10,"¡°Grea stopover hotel¡±","Could be more choice of TV channels Great bed, excellent pillows Lovely room Very nice swimming pool areaStayed in June "
"802",802,"Indonesia","<U+2022> Solo traveller<U+2022> Business King Room - Non-Smoking<U+2022> Stayed 1 night<U+2022> Submitted via mobile",10,"¡°Very good airports hotel¡±","Nothing  The roomStayed in May "
