"","X","nationality","tags","score","content","content_detail"
"258",258,"Singapore","<U+2022> Solo traveller<U+2022> Superior Double or Twin Room<U+2022> Stayed 1 night",4.6,"¡°Disappointed for what you get for the price¡±","The intention of being an eco friendly resort is really great, this was the main reason for us to stay However this should not be the reason for cutting corners on quality in other areas (breakfast food quality and taste was a bit of a led down and the overall resort looks a bit tired and could  do with a bit of TLC  There is a great spot on the roof top , where a bar seems to have been but seems to have been stopped - shame Insulation between the room is ok - but for rooms over looking the pool it is noisy - especially the water feature which starts fairly early for holidaymakers ( pm) Room comfort is basic but overall good An extra mirror in the room would be good The aircon gets started as you leave the room to dry out the humidity in the room, I can get that in some extend  however I don't get why it is set so low It feels like getting into the arctic especially when you com back in from the pool!something which should really be taken care of especiallyhey it might even help to be more environmentally friendly ! Last : great location in Front of Siloso beach 's attraction, that is maybe the justification for the room to be a bit costly versus what I would expect for the price The right intention to be sustainable, environmentally friendly  socially engagedStayed in September "
"259",259,"Singapore","<U+2022> Leisure trip<U+2022> Family with young children<U+2022> Superior Double or Twin Room<U+2022> Stayed 1 night<U+2022> Submitted via mobile",6.9,"¡°Its old wooden¡±","The tv too small and no wifi Its old woodenStayed in September "
"260",260,"Singapore","<U+2022> Leisure trip<U+2022> Family with young children<U+2022> Roof Garden Suite Queen<U+2022> Stayed 1 night<U+2022> Submitted via mobile",6.7,"¡°Good.¡±","The facilities & room felt dated Breakfast spread is limited Staff were accommodatingStayed in September "
"261",261,"Singapore","<U+2022> Leisure trip<U+2022> Group<U+2022> Superior Double or Twin Room<U+2022> Stayed 1 night<U+2022> Submitted via mobile",7.5,"¡°Overall was satisfactory¡±","The breakfast The locationStayed in September "
"262",262,"Singapore","<U+2022> Leisure trip<U+2022> Family with young children<U+2022> Superior Double or Twin Room<U+2022> Stayed 2 nights<U+2022> Submitted via mobile",5.4,"¡°the pool is nice.¡±","toilet is very very small room is not very clean I can spot ants everywhere the pool is nice I asked for few upgrade from superior room and was given a deluxe roomStayed in September "
"263",263,"Singapore","<U+2022> Leisure trip<U+2022> People with friends<U+2022> Superior Double or Twin Room<U+2022> Stayed 1 night<U+2022> Submitted via mobile",7.5,"¡°Environment  good¡±","Nil Environment  goodStayed in September "
"264",264,"Singapore","<U+2022> Leisure trip<U+2022> Family with young children<U+2022> Superior Double or Twin Room<U+2022> Stayed 1 night",10,"¡°Simply wonderful!¡±","maybe more variety for breakfast-something more local i think all the staff at the resort are very well trained, courteous and friendly  Service always comes with a smile  i simply love the swimming pool with its vast length, the waterfall, bubble pool and my son loves the slide Plus he loved the free Segway ride The Eco tour was very interesting and i love the Roof Garden, just wished i had more time to enjoy the view at the top We will definitely come back againStayed in September "
"265",265,"Australia","<U+2022> Leisure trip<U+2022> Solo traveller<U+2022> Superior Double or Twin Room<U+2022> Stayed 2 nights<U+2022> Submitted via mobile",9.6,"¡°a slice of peace and tranquility amid a bustling tourist area.¡±","I only stayed  nights! The location on the beach was great and the property incorporated nature while being eco friendly and relaxingThe natural spring pool and waterfall was blissStayed in September "
"266",266,"Singapore","<U+2022> Leisure trip<U+2022> Family with young children<U+2022> Deluxe Double or Twin Room<U+2022> Stayed 1 night<U+2022> Submitted via mobile",8.3,"¡°Place and stay would be perfect if maintenance of the place can be improved. Wooden planks sunken in¡±"," Place and stay would be perfect if maintenance of the place can be improved Wooden planks sunken in and is hazardous Else everything is awesomeStayed in August "
"267",267,"Singapore","<U+2022> Leisure trip<U+2022> Couple<U+2022> Roof Garden Suite Queen<U+2022> Stayed 2 nights<U+2022> Submitted via mobile",7.9,"¡°A wonderful staycay to celebrate my other half's birthday!¡±","NIL The private jacuzzi at the roof (mine was the suite)Stayed in September "
"268",268,"Singapore","<U+2022> Leisure trip<U+2022> Family with young children<U+2022> Superior Double or Twin Room<U+2022> Stayed 2 nights<U+2022> Submitted via mobile",10,"¡°To relax with nature environment pleasant place.¡±"," Beautiful Swimming pool kids will sure love itStayed in September "
"269",269,"Singapore","<U+2022> Leisure trip<U+2022> Family with young children<U+2022> Deluxe Double or Twin Room<U+2022> Stayed 1 night<U+2022> Submitted via mobile",7.5,"¡°Enjoyable for overnight stay only.¡±","The facilities were quite rundown The convenience of the locationStayed in September "
"270",270,"Singapore","<U+2022> Leisure trip<U+2022> Family with young children<U+2022> Superior Double or Twin Room<U+2022> Stayed 1 night<U+2022> Submitted via mobile",8.3,"¡°Great location close to the beach and other attractions like the Luge¡±","There is a carpark on the premises but unless you book directly with the resort, you have to park at beach carpark which is a walk away Kids loved the pool and slides I liked the fact that they used natural spring water and sanitised the water not with chlorine but iodised salt :)Stayed in September "
"271",271,"Singapore","<U+2022> Leisure trip<U+2022> Couple<U+2022> Superior Double or Twin Room<U+2022> Stayed 2 nights<U+2022> Submitted via mobile",10,"¡°Perfect view, with the perfect nature concept with great service.¡±","The location!:) we wanted to go Adventure cove on the first day but needed a place for our bags So we actually went to beach station, walked to Siloso beach resort, put our bags down, changed, and walked back to the monorail It's really only the location, but considering the view, this disadvantage was really greatly compensated with Ooh I love the croissants I love the view that this place offered I love that they gave us an upgrade of the room I love their good service I love the room! I really like the openview concept It doesn't have the enclosed, dark and creepy corridors Everything was so infused in natureStayed in September "
"272",272,"Singapore","<U+2022> Leisure trip<U+2022> Family with young children<U+2022> Deluxe Adjoining Room<U+2022> Stayed 1 night<U+2022> Submitted via mobile",7.5,"¡°Meh¡±","Noisy aircon kept me up, run-down condition Basic breakfast, staff who acted like the guests weren't there Great locationStayed in September "
"273",273,"Australia","<U+2022> Leisure trip<U+2022> Couple<U+2022> Superior Double or Twin Room<U+2022> Stayed 2 nights",6.3,"¡°Overall, a little underwhelming.¡±","The whole property is looking tired and jaded It is overdue for a makeoverThe included breakfast was adequate for a western palate The pool was very welcome, just needs more shadeStayed in September "
"274",274,"Singapore","<U+2022> Leisure trip<U+2022> Couple<U+2022> Roof Garden Suite Queen<U+2022> Stayed 1 night<U+2022> Submitted via mobile",8.3,"¡°Romantic n nice place to paktor. :)¡±","Service staff a bit slow The jacuzzi is the bestStayed in September "
"275",275,"Singapore","<U+2022> Leisure trip<U+2022> Family with young children<U+2022> Superior Double or Twin Room<U+2022> Stayed 2 nights<U+2022> Submitted via mobile",8.3,"¡°The ambience.¡±"," The ambienceStayed in September "
"276",276,"Singapore","<U+2022> Leisure trip<U+2022> Couple<U+2022> Superior Double or Twin Room<U+2022> Stayed 2 nights<U+2022> Submitted via mobile",9.2,"¡°The waterfall pool and the location near to the beach and...¡±"," The waterfall pool and the location near to the beach and walking distance to the mono rail stationStayed in September "
"277",277,"Singapore","<U+2022> Leisure trip<U+2022> Group<U+2022> Superior Double or Twin Room<U+2022> Stayed 1 night<U+2022> Submitted via mobile",7.9,"¡°Great experience overall¡±","Carpet was old Nice pool and great view Good value for moneyStayed in September "
"278",278,"Singapore","<U+2022> Leisure trip<U+2022> Family with young children<U+2022> Deluxe Double or Twin Room<U+2022> Stayed 2 nights<U+2022> Submitted via mobile",4.2,"¡°It is very disappointing.¡±","It is very disappointing During our second night of stay, a group of students from NTU sports club, who stayed in several rooms in the resort, made a lot of noise from pm till next day around  am Running, shouting in the building corridors from room to room, got drunken, frequently opened and closed doors loudly that made people cannot sleep Quite some guests complaint to the reception but still nothing effective was done to put down the noise It was a shame for these NTU students with their bad behaviors in publicStayed in September "
"279",279,"Singapore","<U+2022> Leisure trip<U+2022> Couple<U+2022> Deluxe Double or Twin Room<U+2022> Stayed 2 nights<U+2022> Submitted via mobile",9.2,"¡°Best view of the beach.¡±"," Best view of the beach Stayed in September "
"280",280,"Singapore","<U+2022> Leisure trip<U+2022> Family with young children<U+2022> Roof Garden Suite Queen<U+2022> Stayed 2 nights<U+2022> Submitted via mobile",9.2,"¡°Eco friendly, lots of greenery, best view of beach¡±"," Eco friendly, lots of greenery, best view of beachStayed in September "
"281",281,"Singapore","<U+2022> Leisure trip<U+2022> Family with young children<U+2022> Roof Garden Suite Queen<U+2022> Stayed 1 night",2.9,"¡°wont go back again¡±","It was a roof top premium Queen suite that cost over $ per night  Though the sea view was great, but ) Jaccuzi pool on the roof top was not functioning properly) Room lights were too dim) Furniture and furnishings were very old and not well maintained) Reception Staff (not all) was not friendly and was impatient) Room size is disappointedly small) Bed curtains had stains Allowed extension of stay till pm on check out dayStaff at cafe were very friendly and attentiveNice touches of nature within the premiseGreat sea viewStayed in September "
"282",282,"Singapore","<U+2022> Leisure trip<U+2022> Family with young children<U+2022> Superior Double or Twin Room<U+2022> Stayed 2 nights",5.4,"¡°Location¡±","The overall appearance of the building and the room cleanliness LocationStayed in September "
"283",283,"United Kingdom","<U+2022> Leisure trip<U+2022> Couple<U+2022> Superior Double or Twin Room<U+2022> Stayed 1 night<U+2022> Submitted via mobile",9.6,"¡°The whole vibe of the property was great, in amongst...¡±","The shower in the bathroom was a shocking design There were massive gaps between the door and the frame (about cm) so water just went all over the bathroom floor and it was completely unavoidable The whole vibe of the property was great, in amongst gorgeous trees, the pool was absolutely stunning And the view from our room was greatStayed in September "
"284",284,"Singapore","<U+2022> Leisure trip<U+2022> Family with young children<U+2022> Deluxe Double or Twin Room<U+2022> Stayed 2 nights<U+2022> Submitted via mobile",9.2,"¡°Fantastic !¡±"," Croissants served hot  The staff are very friendlyStayed in September "
"285",285,"Poland","<U+2022> Leisure trip<U+2022> Family with young children<U+2022> Deluxe Double or Twin Room<U+2022> Stayed 2 nights",8,"¡°roof terrace at level 8 - great place for chillout with beer¡±"," roof terrace at level  - great place for chillout with beerStayed in August "
"286",286,"United Kingdom","<U+2022> Leisure trip<U+2022> Couple<U+2022> Deluxe Double or Twin Room<U+2022> Stayed 6 nights<U+2022> Submitted via mobile",8.8,"¡°Relaxation, eco friendly, on the beach, fantastic pool.¡±","Everything was good Great hotel in beautiful surroundings, staff are excellent and nothing is too much trouble for them, highly recommend locationStayed in September "
"287",287,"Singapore","<U+2022> Leisure trip<U+2022> Family with young children<U+2022> Superior Double or Twin Room<U+2022> Stayed 2 nights<U+2022> Submitted via mobile",6.3,"¡°Average¡±","There is no Wi-Fi access  Acessible to the beachStayed in September "
"288",288,"Singapore","<U+2022> Leisure trip<U+2022> Couple<U+2022> Superior Double or Twin Room<U+2022> Stayed 2 nights<U+2022> Submitted via mobile",9.2,"¡°Comfortable and quiet ambient. No worries for getting breakfast.¡±","View from room Blocked by trees Provided toothbrush too stiff & caused bleeding of gum More varieties in the breakfast eg bacon,vegetables, fish ball, curry puffStayed in September "
"289",289,"Singapore","<U+2022> Leisure trip<U+2022> Family with young children<U+2022> Superior Double or Twin Room<U+2022> Stayed 1 night<U+2022> Submitted via mobile",5,"¡°The location, just on the beach and near all activities.¡±","The rooms are very small, and very humid The breakfast looks like a low quality canteen  The location, just on the beach and near all activities The swimming pool which is nice for kidsStayed in September "
"290",290,"Singapore","<U+2022> Leisure trip<U+2022> Family with young children<U+2022> Superior Double or Twin Room<U+2022> Stayed 2 nights<U+2022> Submitted via mobile",8.8,"¡°good and relax.¡±","nothing Everything was good and nices to stayStayed in August "
"291",291,"Singapore","<U+2022> Leisure trip<U+2022> Couple<U+2022> Roof Garden Suite Queen<U+2022> Stayed 1 night",7.1,"¡°likes the roof jaccuzzi:D¡±"," likes the roof jaccuzzi:DStayed in August "
"292",292,"Singapore","<U+2022> Leisure trip<U+2022> Family with young children<U+2022> Superior Double or Twin Room<U+2022> Stayed 1 night<U+2022> Submitted via mobile",5.8,"¡°Getting run down¡±","The pool had no guard on duty to stop people from eating and drinking around the pool, the breakfast was of so-so quality and little variety, the wallpaper was peeling mostly off every wall, the toiletries offered was minimal and frankly rather lousy, the towels were on the thin side and the doors stiff and hard to open Frankly not really worth the high price we paid! The view and the poolStayed in August "
"293",293,"Kuwait","<U+2022> Leisure trip<U+2022> Family with young children<U+2022> Superior Double or Twin Room<U+2022> Stayed 4 nights",4.2,"¡°Would not come again.¡±","The AC in the room was not effective  The wait for check-in was very long, they did not consider making any exceptions for giving early check-in despite repeated requests Laundry spoiled my clothes with a rusted dryer Maintenance level of property is very poor Very high cost for the low quality service of hotel Good location, easily accessible to all attractionsStayed in August "
"294",294,"Singapore","<U+2022> Leisure trip<U+2022> Family with young children<U+2022> Deluxe Adjoining Room<U+2022> Stayed 2 nights<U+2022> Submitted via mobile",7.5,"¡°Had fun. Location was good . Accessible¡±","Quite run downStayed in August "
"295",295,"India","<U+2022> Leisure trip<U+2022> Family with young children<U+2022> Superior Double or Twin Room<U+2022> Stayed 1 night<U+2022> Submitted via mobile",8.3,"¡°Birds, small animals in the breakfast area¡±","Birds, small animals in the breakfast areaStayed in August "
"296",296,"Singapore","<U+2022> Leisure trip<U+2022> Family with young children<U+2022> 2 rooms<U+2022> Stayed 1 night<U+2022> Submitted via mobile",5.4,"¡°We loved the pool!¡±","I had requested three rooms together to find that the rooms were on different levels until I asked but I requested them together I then get told ""Okie we will upgrade your other Two rooms"" but they were standard rooms and still placed apart from each other Breakfast was a bit disappointing because we are all vegetarian and found at : they were out of hash browns and the baked beans took a while to replace We loved the pool! The Mee Goreng & the Fusili pasta in a pomadero sauce was very tasty !Stayed in August "
"297",297,"Singapore","<U+2022> Leisure trip<U+2022> Solo traveller<U+2022> Superior Double or Twin Room<U+2022> Stayed 2 nights<U+2022> Submitted via mobile",5,"¡°The property is nestled in lots of greenery.¡±","I didn't see bed bugs, but the bed sheets that i slept on makes my skin itch Breakfast has limited variety There were guests smoking at the pool area  The property is nestled in lots of greenery The pool water is actually from the springsStayed in August "
"298",298,"Singapore","<U+2022> Leisure trip<U+2022> Group<U+2022> Superior Double or Twin Room<U+2022> Stayed 1 night<U+2022> Submitted via mobile",3.3,"¡°I didn't enjoy my stay as we were itching the whole night.¡±","The amount of insects in the room BreakfastStayed in August "
"299",299,"Singapore","<U+2022> Leisure trip<U+2022> Couple<U+2022> Superior Double or Twin Room<U+2022> Stayed 1 night<U+2022> Submitted via mobile",3.8,"¡°Not a pleasant stay. Thankfully it was just for a night.¡±","Superior room was too run down Need to renovate and refurbish There were even tiny ants that bite Floor under the beds were dusty Shower head was leaking Towels were oldStayed in August "
"300",300,"Singapore","<U+2022> Couple<U+2022> Superior Double or Twin Room<U+2022> Stayed 1 night<U+2022> Submitted via mobile",7.9,"¡°Swimming pools¡±"," Swimming poolsStayed in August "
"301",301,"Australia","<U+2022> Leisure trip<U+2022> Couple<U+2022> Superior Double or Twin Room<U+2022> Stayed 2 nights",7.1,"¡°Need a nice air-conditioned place to stay when you have to...¡±","Need a nice air-conditioned place to stay when you have to get out of your room and wait until it is time to go to the airportStayed in August "
"302",302,"Singapore","<U+2022> Leisure trip<U+2022> Couple<U+2022> Superior Double or Twin Room<U+2022> Stayed 6 nights<U+2022> Submitted via mobile",5,"¡°Good location but facilities and cleanliness need to improve a lot.¡±","First day, comforter was stained with blood So the whole  days of our stay we are always worried if the bedsheet is properly washed or changed The shower room was a mess The shower head too small and the glass door doesnt fit to the shower room, all the water foes outside the shower area Toilet doest have any bidet The soup wasnt topped up at all even after they cleaned The gym was too way smelly and facilities too little I like the location exactly located in front of the beach I love the swimming pool tooStayed in August "
"303",303,"Bangladesh","<U+2022> Business trip<U+2022> Couple<U+2022> Deluxe Double or Twin Room<U+2022> Stayed 4 nights",5,"¡°The room good with niece view and equipped with nice...¡±"," The room good with niece view and equipped with nice amenities The staffs friendly and helpfula<U+><U+D>Stayed in August "
"304",304,"Hong Kong","<U+2022> Leisure trip<U+2022> Group<U+2022> Superior Double or Twin Room<U+2022> Stayed 4 nights<U+2022> Submitted via mobile",5.8,"¡°Booking.com charged me $100. Hotel said will refund 7 days later. Why not refund at chk out?¡±","The courtesy The poolStayed in August "
"305",305,"Singapore","<U+2022> Leisure trip<U+2022> Family with young children<U+2022> Roof Garden Suite Queen<U+2022> Stayed 1 night<U+2022> Submitted via mobile",6.3,"¡°Nice cosy place spoilt by noisy nightclub beside it.¡±","Its beside a night club and it was so noisy Impossible to sleep Hope the hotel make some agreement to turn down the volume soon Next to the beach The pool is nice tooStayed in July "
"306",306,"Australia","<U+2022> Leisure trip<U+2022> Family with young children<U+2022> Superior Double or Twin Room<U+2022> Stayed 7 nights<U+2022> Submitted via mobile",3.8,"¡°One of the worst stays I've had in. Sentosa¡±","The bedroom wasn't cleaned properly The pool was not cleaned once in the five day we were there Had a dress taken from my room and staff didn't seem to care at all My granddaughter and I got bitten by something every time we went back into our room  So had bites all over us Not much at allStayed in August "
"307",307,"China","<U+2022> Leisure trip<U+2022> Family with young children<U+2022> Superior Double or Twin Room<U+2022> Stayed 3 nights<U+2022> Submitted via mobile",6.7,"¡°Location is fine ¡±","Facilities are old Air conditioning is noisy Location is fine Stayed in August "
"308",308,"South Korea","<U+2022> Leisure trip<U+2022> Couple<U+2022> Superior Double or Twin Room<U+2022> Stayed 1 night",7.5,"¡°Swimming pool was huge and great.¡±"," Swimming pool was huge and great And there are beautiful beach in front of resortStayed in August "
"309",309,"New Zealand","<U+2022> Leisure trip<U+2022> Couple<U+2022> Superior Double or Twin Room<U+2022> Stayed 2 nights",9.5,"¡°Nice, relaxing eco friendly place to stay¡±"," Very, very busy place so unable to get early check in or late check out but staff where very obliging storing luggage Great location to beach, restaurants and entertainmentStayed in August "
"310",310,"Australia","<U+2022> Leisure trip<U+2022> Family with young children<U+2022> Deluxe Adjoining Room<U+2022> Stayed 5 nights<U+2022> Submitted via mobile",7.9,"¡°Adjourning room option¡±","It was very noisy at night as the kids were loud in the pool / on the slide Not sure if there is a curfew for using the pool If not there should be one Adjourning room optionStayed in August "
"311",311,"Singapore","<U+2022> Leisure trip<U+2022> Family with young children<U+2022> Deluxe Double or Twin Room<U+2022> Stayed 1 night<U+2022> Submitted via mobile",10,"¡°One of the best resort stays ever!¡±","The food at the cafe was quite bad However, breakfast was great I liked that it was so close to the beachStayed in August "
"312",312,"India","<U+2022> Leisure trip<U+2022> Family with young children<U+2022> Deluxe Double or Twin Room<U+2022> Stayed 3 nights<U+2022> Submitted via mobile",3.3,"¡°Not worth staying.¡±","Resort with  star amenities Very basic & old furnitures Needs to refurbish Moreover, no proper f&b and uncleen property Staff is very rude & hopeless Not much to sayStayed in August "
"313",313,"Vietnam","<U+2022> Leisure trip<U+2022> Family with young children<U+2022> Superior Double or Twin Room<U+2022> Stayed 2 nights<U+2022> Submitted via mobile",7.5,"¡°Wonderful¡±","The bathroom is too old Spring stream is greatStayed in August "
"314",314,"Singapore","<U+2022> Leisure trip<U+2022> Family with young children<U+2022> Deluxe Double or Twin Room<U+2022> Stayed 3 nights<U+2022> Submitted via mobile",7.5,"¡°Swimming pool¡±","TV, breakfast  Swimming poolStayed in August "
"315",315,"India","<U+2022> Leisure trip<U+2022> Family with young children<U+2022> Deluxe Double or Twin Room<U+2022> Stayed 2 nights",2.5,"¡°Horrible Stay. Poor Staff with rude & unfriendly behavior.¡±","Very poor property Staff was very rude & unfriendly nothingStayed in August "
"316",316,"Japan","<U+2022> Leisure trip<U+2022> Family with young children<U+2022> 2 rooms<U+2022> Stayed 2 nights<U+2022> Submitted via mobile",10,"¡°Great place for enjoying the island or just relaxing.¡±","Bed was a bit stiff for our Western comfort Loved the atmosphere of the hotel Lovely greenery everywhere (and peacocks) So enjoyed the rooftop tub, shower, and sunning deck Bonus: washer and dryer on siteStayed in August "
"317",317,"Philippines","<U+2022> Leisure trip<U+2022> Family with young children<U+2022> Superior Double or Twin Room<U+2022> Stayed 2 nights<U+2022> Submitted via mobile",5,"¡°The kids like to go out rather stay in the hotel. It's not a kids friendly though.¡±"," My family like the croissants and and the chocolate filling breadStayed in August "
"318",318,"United Arab Emirates","<U+2022> Leisure trip<U+2022> Family with young children<U+2022> Superior Double or Twin Room<U+2022> Stayed 1 night<U+2022> Submitted via mobile",7.9,"¡°Just what we needed for a relaxing few days¡±","Food was a little average Spacious rooms Great pool Staff very accommodating to our needsStayed in July "
"319",319,"Australia","<U+2022> Leisure trip<U+2022> Family with young children<U+2022> Superior Double or Twin Room<U+2022> Stayed 2 nights<U+2022> Submitted via mobile",10,"¡°Friendly staff. Very welcoming¡±","More selection on breakfast as theh dont cater enough for the american style breakfast Close to beach and activitiesStayed in August "
"320",320,"Singapore","<U+2022> Leisure trip<U+2022> Couple<U+2022> Superior Double or Twin Room<U+2022> Stayed 1 night<U+2022> Submitted via mobile",6.7,"¡°Average.¡±","Breakfast was bad Near the beachStayed in August "
"321",321,"Singapore","<U+2022> Leisure trip<U+2022> Solo traveller<U+2022> Deluxe Double or Twin Room<U+2022> Stayed 1 night<U+2022> Submitted via mobile",8.3,"¡°My each stay in this hotel is I always got what I have...¡±","Food is abit tooSaltish for young kidsBreakfast spread has not really improved My each stay in this hotel is I always got what I have requested as in earlier check in and easy access to the pool And requested on a clean room is always not to my disappointment but I have not evenOnce given a room with a beach viewHopefully my next stay on Aug  in the roof TOP suite room I would be given a beach viewVery boring for kids to have a forest view in the roomThank youStayed in August "
