"","X","nationality","tags","score","content","content_detail"
"759",759,"Singapore","<U+2022> Leisure trip<U+2022> Family with young children<U+2022> Superior Double or Twin Room<U+2022> Stayed 2 nights<U+2022> Submitted via mobile",6.7,"¡°View of the beach was nice.¡±","Room  were small and slightly dark and the curtain are too transparent Need to improve on the lighting, cleanliness on the floor and curtain view of the beachStayed in December "
"760",760,"Singapore","<U+2022> Leisure trip<U+2022> Family with young children<U+2022> Superior Double or Twin Room<U+2022> Stayed 2 nights<U+2022> Submitted via mobile",7.5,"¡°Excellent location for beach goers.¡±","No beach sport items for loan Nature environmentStayed in December "
"761",761,"Singapore","<U+2022> Leisure trip<U+2022> Family with young children<U+2022> Deluxe Double or Twin Room<U+2022> Stayed 1 night<U+2022> Submitted via mobile",7.1,"¡°Perhaps Not to visit on season period, price high, Bf normal. Only attractive is the pool.¡±","Breakfast Not much variety Too many flies at outdoor area The poolStayed in December "
"762",762,"Singapore","<U+2022> Leisure trip<U+2022> Group<U+2022> Roof Garden Suite Queen<U+2022> Stayed 1 night",7.9,"¡°Location¡±","Food wasn't that good  No desk  More expensive than it should have been LocationStayed in December "
"763",763,"Singapore","<U+2022> Leisure trip<U+2022> Family with young children<U+2022> Deluxe Double or Twin Room<U+2022> Stayed 1 night<U+2022> Submitted via mobile",5.8,"¡°Staff are friendly and helpful.¡±","The blue towel used outdoor are not clean Staff are friendly and helpfulStayed in December "
"764",764,"India","<U+2022> Leisure trip<U+2022> Couple<U+2022> Superior Double or Twin Room<U+2022> Stayed 2 nights",7.5,"¡°cosy & comfortable¡±","housekeeping can be improved in odd hours overall  quite cosy outlook & good surroundings , staff was goodStayed in November "
"765",765,"Singapore","<U+2022> Leisure trip<U+2022> Family with young children<U+2022> Superior Double or Twin Room<U+2022> Stayed 1 night<U+2022> Submitted via mobile",8.3,"¡°Short holiday¡±"," The hotel is just next to the beachStayed in December "
"766",766,"Singapore","<U+2022> Leisure trip<U+2022> Family with young children<U+2022> Deluxe Double or Twin Room<U+2022> Stayed 1 night<U+2022> Submitted via mobile",5.8,"¡°Poor management¡±","The rooms are poorly maintained Mine was a deluxe room but sink leaking and housekeeping was not done thoroughlyHad dinner at the restaurant and kids ordered lasagne, however it was terribly done Had a foul smell coz i guess meat had been exposed or not cooked well Was worried kids could have food poisoning The location and swimming poolStayed in December "
"767",767,"Singapore","<U+2022> Leisure trip<U+2022> Family with young children<U+2022> Superior Double or Twin Room<U+2022> Stayed 1 night<U+2022> Submitted via mobile",5.8,"¡°Just okay ¡±","The room is old The bedsheets are not so white anymore, the bed and the pillows are  not comfortable and it gives the impression that it has not been replaced for a long time  The swimming pool is great The location is perfect if you just want to stay around Sentosa island Stayed in December "
"768",768,"Singapore","<U+2022> Leisure trip<U+2022> Family with young children<U+2022> Superior Double or Twin Room<U+2022> Stayed 3 nights<U+2022> Submitted via mobile",5.4,"¡°For a short trip would be sufficient but not for a Long stay.¡±","The breakfast The Swimming poolStayed in December "
"769",769,"Singapore","<U+2022> Leisure trip<U+2022> Family with young children<U+2022> Superior Double or Twin Room<U+2022> Stayed 2 nights<U+2022> Submitted via mobile",3.3,"¡°Quietness¡±","Service staff were not friendly QuietnessStayed in December "
"770",770,"Singapore","<U+2022> Leisure trip<U+2022> Family with young children<U+2022> Superior Double or Twin Room<U+2022> Stayed 2 nights<U+2022> Submitted via mobile",8.3,"¡°Celebrated birthday¡±","The breakfast had poor variety The Swimming poolStayed in November "
"771",771,"Singapore","<U+2022> Leisure trip<U+2022> Family with young children<U+2022> Superior Double or Twin Room<U+2022> Stayed 1 night<U+2022> Submitted via mobile",7.9,"¡°Nature¡±","Breakfast taste NatureStayed in November "
"772",772,"Singapore","<U+2022> Leisure trip<U+2022> Family with young children<U+2022> Superior Double or Twin Room<U+2022> Stayed 1 night<U+2022> Submitted via mobile",10,"¡°Siloso beach resort is an excellent place¡±","Due to renovation wifi in room was not working which should be rectified soon Breakfast was very good with quite  varied options Location is gud and the resort is beautiful I vouch for itStayed in December "
"773",773,"Singapore","<U+2022> Leisure trip<U+2022> Group<U+2022> Superior Double or Twin Room<U+2022> Stayed 1 night<U+2022> Submitted via mobile",5.4,"¡°Tiny room with great view¡±","Room size, bigger fridge The view is niceStayed in November "
"774",774,"Australia","<U+2022> Leisure trip<U+2022> Family with young children<U+2022> Superior Double or Twin Room<U+2022> Stayed 2 nights<U+2022> Submitted via mobile",4.2,"¡°Not happy sold as a bargain but actually just cheap rooms¡±","Internet availability poor PoolStayed in December "
"775",775,"United Kingdom","<U+2022> Leisure trip<U+2022> Family with young children<U+2022> Superior Double or Twin Room<U+2022> Stayed 1 night",7.1,"¡°Wifi difficult¡±","Very limited wifi None in room staff helpfulStayed in December "
"776",776,"Saudi Arabia","<U+2022> Leisure trip<U+2022> Family with young children<U+2022> Superior Double or Twin Room<U+2022> Stayed 4 nights<U+2022> Submitted via mobile",2.9,"¡°Staff wasn't very pleasant, rooms were old... overall wasn't a comfortable stay.¡±","It's an eco friendly hotel but having ants in the loo isn't comfortable Property needs renovation Beds n everything seems rusty n oldStayed in December "
"777",777,"Malaysia","<U+2022> Leisure trip<U+2022> Family with young children<U+2022> Superior Double or Twin Room<U+2022> Stayed 1 night<U+2022> Submitted via mobile",5.8,"¡°The environment full of trees !¡±","No nice dinner place for dinner ,have to go out again from resort  The environment full of trees !!Stayed in December "
"778",778,"Singapore","<U+2022> Leisure trip<U+2022> Group<U+2022> Superior Double or Twin Room<U+2022> Stayed 1 night<U+2022> Submitted via mobile",3.3,"¡°will not come again¡±","no internet in the room so i can't do my work No phone signal so i totally lost contact when i in the roomStayed in December "
"779",779,"Singapore","<U+2022> Leisure trip<U+2022> Family with young children<U+2022> Superior Double or Twin Room<U+2022> Stayed 1 night<U+2022> Submitted via mobile",10,"¡°Siloso Beach Resort - Love!¡±"," Totally loved our family staycation at Siloso Beach Resort! Was disheartened by earlier reviews initially but soon discovered the beauty of this place In fact, It is exactly how a beach resort should be like and we love that it is eco-friendly and so close to nature The deluxe room is comfortably spacious (for our family of four) Importantly, the room and toilet are very clean Room amenities are basic but in very good condition Other reviews described the furniture as old; we think rustic is a better description The staff are very friendly and attentive to our needs The lack of WIFI in the room means our family can interact better with each other instead of each being engrossed with mobile devices Great pool - we all had loads of fun swimming in the ionised spring water and slides! Breakfast may not be international spread but it is hearty enough to start our day well! Highly recommend to those looking for a rustic and natural break from the busy city life of Singapore And have we mentioned that the Siloso beach is just a stone's throw away? :DStayed in December "
"780",780,"Singapore","<U+2022> Leisure trip<U+2022> Family with young children<U+2022> Superior Double or Twin Room<U+2022> Stayed 1 night<U+2022> Submitted via mobile",5.4,"¡°Everything is fine and we enjoyed very much.¡±","No wifi services The croissant is superb Stayed in December "
"781",781,"Singapore","<U+2022> Leisure trip<U+2022> People with friends<U+2022> Superior Double or Twin Room<U+2022> Stayed 1 night<U+2022> Submitted via mobile",9.6,"¡°Amazing short staycay with friends!¡±"," Service Staffs are amazing! Accommodate to our needs and very friendly! Stayed in December "
"782",782,"Singapore","<U+2022> Leisure trip<U+2022> Family with young children<U+2022> Superior Double or Twin Room<U+2022> Stayed 2 nights<U+2022> Submitted via mobile",8.3,"¡°Good value for money¡±","No wifi in room The pool and proximity to the beachStayed in November "
"783",783,"Singapore","<U+2022> Leisure trip<U+2022> Family with young children<U+2022> Superior Double or Twin Room<U+2022> Stayed 1 night<U+2022> Submitted via mobile",7.9,"¡°The green surrounding was great!¡±","I was bitten by mosquitoes The green surrounding was great!Stayed in December "
"784",784,"Singapore","<U+2022> Leisure trip<U+2022> Couple<U+2022> Superior Double or Twin Room<U+2022> Stayed 1 night<U+2022> Submitted via mobile",6.7,"¡°A chilling stay.. e<U+009F><U+0098><U+00BD>e<U+009F><U+0091>¡ìe<U+009F><U+0092><U+0095>¡±","To improve the service I would like to suggest about the wifi service which is really very bad, u guys should do something about itOther then that it's awesome experience Thanks It's was fantastic experience which we been welcomed by small green Snake, and the rooms are clean and very cozyWe would like to thanks the reseption staff, they were very friendlyoverall it's was a pleasant experience to be thereStayed in November "
"785",785,"Bangladesh","<U+2022> Business trip<U+2022> Solo traveller<U+2022> Superior Double or Twin Room<U+2022> Stayed 1 night",10,"¡°Just Excellent¡±","Nothing No complain at all Everything was so good Nice location Service and food were satisfactory, staffs were very cordial and supportive Not commercial attitude I was late to check out but they did not charge me extra for that I have no complain I will stay there again if I go next timeStayed in November "
"786",786,"Singapore","<U+2022> Leisure trip<U+2022> Family with young children<U+2022> Superior Double or Twin Room<U+2022> Stayed 1 night<U+2022> Submitted via mobile",5.4,"¡°Buffet breakfast¡±","Facilities & surrounding Buffet breakfastStayed in December "
"787",787,"United Kingdom","<U+2022> Leisure trip<U+2022> Family with young children<U+2022> Deluxe Double or Twin Room<U+2022> Stayed 3 nights<U+2022> Submitted via mobile",9.6,"¡°Brilliant resort with an emphasis on  sustainable tourism.¡±"," Brilliant resort with an emphasis on  sustainable tourism My son absolutely loved the incredible swimming pool with its slides, waterfall and superb size Would definitely come back here again one dayStayed in November "
"788",788,"Singapore","<U+2022> Leisure trip<U+2022> Family with young children<U+2022> Superior Double or Twin Room<U+2022> Stayed 1 night",9.6,"¡°Thumbs up except for wifi.¡±","World class hotels like this should look into improving its wifi networks Totally horrible wifi connection This resort is totally amazing with its eco concept Totally deserves a World Class award for being eco The swimming pool partially or totally filled with Sentosa's spring water is one of its kind in this world, non-chlorinated , with ionised salt, totally feels good for my sensitive skinStayed in December "
"789",789,"Australia","<U+2022> Leisure trip<U+2022> Couple<U+2022> Superior Double or Twin Room<U+2022> Stayed 7 nights<U+2022> Submitted via mobile",7.5,"¡°Great location just needs a bit of investment in the room finishes.¡±","I originally booked a superior room thinking superior meant a better quality room than average however I was very disappointed Went to reception and asked for a better room which was kindly arranged The second room was much better However the two neighbouring rooms were less than sociable partying all night The night staff tried their best to sort out the two rowdy parties in the two neighbouring rooms as best as possible but to no avail Whilst at breakfast the following morning the manager approached us and was very apologetic and moved us to the honeymoon suit I thought his actions were very commendable In general the hotel is located in a great area but needs a bit of investment in some of the rooms This has the possibility of being a top rate resort The hotel is in a great location for santosa island The location is right on the beach and easy access to the mono rail which in turn allows access to all the attractions The breakfast buffet is basic but excellent value for money All you can eat for $ Makes for a great start to every morningStayed in December "
"790",790,"Singapore","<U+2022> Leisure trip<U+2022> Group<U+2022> Superior Double or Twin Room<U+2022> Stayed 1 night",3.3,"¡°Very Dis..¡±","Not at all responsible - if do not know how to fix the facility Request fix my toilet door-no responseRequest to fix the aircon -come and measure and do nothing at allWhat a good service ?Room Wifi none at my level -damm dissapointed None is good for this timeStayed in December "
"791",791,"Singapore","<U+2022> Leisure trip<U+2022> Solo traveller<U+2022> Deluxe Double or Twin Room<U+2022> Stayed 1 night<U+2022> Submitted via mobile",6.7,"¡°Satisfactory¡±","There were insects in my bathtub Yes, the croissants were good but the breakfast spread could have been better enjoyed the scenery and quiet though it was a short stay Appreciate the environment-friendly movement and inclusiveness of the management in running this placeStayed in December "
"792",792,"Singapore","<U+2022> Leisure trip<U+2022> Family with young children<U+2022> Superior Double or Twin Room<U+2022> Stayed 2 nights<U+2022> Submitted via mobile",7.1,"¡°The location was near the beach and other attractions around.¡±","Wifi is only available at certain levels of the resort so it was a bit of an inconvenience  The location was near the beach and other attractions around The pool was superb and the breakfast was okay Stayed in December "
"793",793,"Australia","<U+2022> Leisure trip<U+2022> Family with young children<U+2022> Superior Double or Twin Room<U+2022> Stayed 6 nights<U+2022> Submitted via mobile",5.4,"¡°Check for local beach concerts before booking¡±","Noisy    Concert on beach  But hotel had notice not to complain about noise  But as the put us in a room closest to beach asked to be moved  Breakfast not worth the extra  TV very small and lack of interesting stations  No movies on demand Location  Pool was excellentStayed in December "
"794",794,"Singapore","<U+2022> Leisure trip<U+2022> Family with young children<U+2022> Superior Double or Twin Room<U+2022> Stayed 1 night<U+2022> Submitted via mobile",7.9,"¡°Free room upgrade¡±","Breakfast is limited, no wifi in room Free room upgradeStayed in November "
"795",795,"Singapore","<U+2022> Leisure trip<U+2022> Family with young children<U+2022> Superior Double or Twin Room<U+2022> Stayed 2 nights<U+2022> Submitted via mobile",4.2,"¡°Is not a resort but more like a chalet¡±","The breakfast is the worst during my years of travel The pool waterfallsStayed in December "
"796",796,"Singapore","<U+2022> Leisure trip<U+2022> Family with young children<U+2022> Superior Double or Twin Room<U+2022> Stayed 2 nights",7.5,"¡°The shower head should be placed a little higher especially...¡±","The shower head should be placed a little higher especially for me a  m heightStayed in November "
"797",797,"Singapore","<U+2022> Leisure trip<U+2022> Group<U+2022> Superior Double or Twin Room<U+2022> Stayed 2 nights<U+2022> Submitted via mobile",7.5,"¡°I like that it was near the event i was attending and its...¡±","No wifi in the room i stayed in Had to frequently go out of the room due to low in network signal I like that it was near the event i was attending and its very convenientStayed in December "
"798",798,"Singapore","<U+2022> Leisure trip<U+2022> Group<U+2022> Superior Double or Twin Room<U+2022> Stayed 2 nights",7.1,"¡°That there was no wifi in the room.¡±","That there was no wifi in the roomStayed in December "
"799",799,"Singapore","<U+2022> Leisure trip<U+2022> Group<U+2022> Superior Double or Twin Room<U+2022> Stayed 1 night<U+2022> Submitted via mobile",9.6,"¡°Proximity to beach and surrounding attractions.¡±","Limited parking Proximity to beach and surrounding attractionsStayed in December "
"800",800,"New Zealand","<U+2022> Leisure trip<U+2022> Family with young children<U+2022> Deluxe Double or Twin Room<U+2022> Stayed 2 nights",3.8,"¡°dissappointed¡±","Breakfast needs to be international Very old property and not maintainedStayed in November "
"801",801,"Singapore","<U+2022> Leisure trip<U+2022> Family with young children<U+2022> Superior Double or Twin Room<U+2022> Stayed 2 nights<U+2022> Submitted via mobile",3.3,"¡°not likely coming again¡±","room was tiny for the price staff denied us extra  towels for our kids when we called housekeeping until my husband went straight to the lobby to request for them even the towels (blue ones) had bleach stains and holes breakfast buffet was really not up to standard - food items seem to be ""hidden"", eg the breads, nasi lemak cannot imagine paying extra $/child for the poor selection & standard of food there is a fine line between being ""eco-friendly"" and ""economical"" i think this hotel leans more towards the latter kids enjoyed the pool and slide although the inner walls were a bit slimeyStayed in December "
"802",802,"South Korea","<U+2022> Business trip<U+2022> Solo traveller<U+2022> Superior Double or Twin Room<U+2022> Stayed 4 nights<U+2022> Submitted via mobile",7.5,"¡°Good to stay with affordable price¡±","WIFI was so weakDifficult to use woober Outdoor pool was excellentStayed in December "
"803",803,"Singapore","<U+2022> Leisure trip<U+2022> Family with young children<U+2022> Superior Double or Twin Room<U+2022> Stayed 2 nights",7.9,"¡°The staff were very warm and friendly.¡±","There were MANY mosquitoes in the room and around the resort My kids and myself were bitten quite badly The staff were very warm and friendly The location of the hotel could not have been better: it is just across the beach and with a beach tram stop just at the door step Enjoyed breakfast with peacocks and squirrels :)Stayed in December "
"804",804,"Malaysia","<U+2022> Family with young children<U+2022> Superior Double or Twin Room<U+2022> Stayed 1 night<U+2022> Submitted via mobile",7.1,"¡°The rooms¡±","The buffet The roomsStayed in November "
"805",805,"Singapore","<U+2022> Leisure trip<U+2022> Couple<U+2022> Superior Double or Twin Room<U+2022> Stayed 2 nights",7.5,"¡°good view, facing the beach¡±","restaurant food at the hotel can be better good view, facing the beachStayed in November "
"806",806,"Singapore","<U+2022> Couple<U+2022> Superior Double or Twin Room<U+2022> Stayed 1 night<U+2022> Submitted via mobile",8.3,"¡°Pleasant and relaxing birthday vacation trip¡±","Maybe you would like to remove the Spa from the website, since it is no longer there, so that it won't create deception to the viewers Could be better if there is a Spa and massage with wine counter Appreciate the male counter staff who make the effort to arrange a nice sea-view room for us upon request And the swimming pool is nicely surrounded by natural greenery which gives superb relaxing feel Well done!!Stayed in November "
"807",807,"Malaysia","<U+2022> Leisure trip<U+2022> Family with young children<U+2022> Superior Double or Twin Room<U+2022> Stayed 3 nights<U+2022> Submitted via mobile",7.5,"¡°The shower was awesome!¡±","Wished they have bigger bed configurations All rooms carried the standard queen size bed only The shower was awesome!Stayed in December "
"808",808,"Singapore","<U+2022> Leisure trip<U+2022> Family with young children<U+2022> Superior Double or Twin Room<U+2022> Stayed 1 night<U+2022> Submitted via mobile",4.6,"¡°Pool¡±","No wifi inside the room PoolStayed in December "
"809",809,"Singapore","<U+2022> Leisure trip<U+2022> Family with young children<U+2022> Superior Double or Twin Room<U+2022> Stayed 1 night<U+2022> Submitted via mobile",10,"¡°Great ECO holiday!¡±","Nothing Great eco friendly holiday with a nice non chlorinated lap pool with natural salt treatment  My kids could swim without goggles and their eyes didnt hurt!Stayed in December "
"810",810,"Singapore","<U+2022> Leisure trip<U+2022> Couple<U+2022> Superior Double or Twin Room<U+2022> Stayed 1 night",3.8,"¡°Terrible stay, would not return¡±","Everything else Breakfast was not good, room was small, bathroom couldn't fit  people, tiny tv, no wifi or data in the room The only good thing about this hotel was the poolStayed in December "
"811",811,"Singapore","<U+2022> Leisure trip<U+2022> Family with young children<U+2022> Deluxe Double or Twin Room<U+2022> Stayed 2 nights<U+2022> Submitted via mobile",6.3,"¡°A little disappointing¡±","The hotel is clean but old Room is so humid which wall is even wet with water leaking when pressing My kid said it is freaky Additionally, breakfast has too little variety with the room rate i am paying Hotdog, baked bean, bread, three types of fruits, bread, cereal, egg, one type of bun and siew mai, and one type of noodle May consider having more food variety Location is excellent which the siloso beach is just across the roadMy kid loves the swimming pool with slides and waterfall No mozzies at allStayed in December "
"812",812,"Singapore","<U+2022> Leisure trip<U+2022> Family with young children<U+2022> Superior Double or Twin Room<U+2022> Stayed 1 night<U+2022> Submitted via mobile",5.4,"¡°Beautiful pool, bedroom poor.¡±","Bed is too small and the toilet smells Very Small shower and tv The pool and landscape are really relaxing They should have made the main pool warm; but still goodStayed in December "
"813",813,"Indonesia","<U+2022> Leisure trip<U+2022> Family with young children<U+2022> Superior Double or Twin Room<U+2022> Stayed 2 nights<U+2022> Submitted via mobile",7.9,"¡°Staffs were super friendly¡±","No wifi in the room Staffs were super friendlyStayed in December "
"814",814,"Russia","<U+2022> Leisure trip<U+2022> Family with young children<U+2022> Superior Double or Twin Room<U+2022> Stayed 20 nights",7.1,"¡°A Wonder of Fun and Rest¡±"," Very nice localion Amasing spring water poolStayed in November "
"815",815,"Singapore","<U+2022> Leisure trip<U+2022> Couple<U+2022> Superior Double or Twin Room<U+2022> Stayed 1 night<U+2022> Submitted via mobile",2.5,"¡°10 out of 10 only 2¡±","So so NoStayed in December "
"816",816,"Singapore","<U+2022> Leisure trip<U+2022> Couple<U+2022> Superior Double or Twin Room<U+2022> Stayed 2 nights<U+2022> Submitted via mobile",7.1,"¡°Good & short staycation.¡±","My room floor is leaking and the safe is not working well I like the quietness of the resort and the swimming poolStayed in November "
"817",817,"Singapore","<U+2022> Leisure trip<U+2022> People with friends<U+2022> Roof Garden Suite Queen<U+2022> Stayed 1 night<U+2022> Submitted via mobile",2.9,"¡°Disappointed. Wasting time and money  ¡±","Very disappointed at the management and the properly Room not even worth for the price we paid for, we paid $ for a garden suite room Staff wasn't friendly and told housekeeping they miss out a towel in the toilet, but they insist there is two towel inside the toilet Bed sheet with blood stains, refrigerator leaking water and we had to switch it off cause it's very near to the power point, and I almost slip off Bathtub drainage problem, water cannot drain off Wifi not available on all floors and all room Safe deposit box not working, had to call the housekeeping again Water pressure during our stay having problem, wasting half of the day sorting out all the problem Breakfast taste bad Really bad A total TURN OFF for us to enjoy our weekend there Wasting our money and time I wouldn't recommend any of my friends to stay here  Quiet and peaceful, eco friendly Stayed in November "
"818",818,"Singapore","<U+2022> Leisure trip<U+2022> Family with young children<U+2022> Superior Double or Twin Room<U+2022> Stayed 1 night<U+2022> Submitted via mobile",6.7,"¡°Scenery¡±","Not clean enough SceneryStayed in November "
"819",819,"Singapore","<U+2022> Leisure trip<U+2022> Family with young children<U+2022> Superior Double or Twin Room<U+2022> Stayed 1 night<U+2022> Submitted via mobile",7.9,"¡°It's a great getaway¡±","Singapore fried noodles or Prata should be available for breakfast The croissant and pastryStayed in November "
"820",820,"Belgium","<U+2022> Business trip<U+2022> Solo traveller<U+2022> Superior Double or Twin Room<U+2022> Stayed 3 nights",7.5,"¡°Nice eco stay¡±","the restaurant dish options could be a bit more The poolStayed in November "
"821",821,"Singapore","<U+2022> Leisure trip<U+2022> Family with young children<U+2022> Superior Double or Twin Room<U+2022> Stayed 1 night<U+2022> Submitted via mobile",7.5,"¡°Nice environment wt sea view room.¡±","The breakfast place can be improved with more variety of food and with air conditioned Nice environment wt sea view roomStayed in November "
"822",822,"United Kingdom","<U+2022> Leisure trip<U+2022> Couple<U+2022> Superior Double or Twin Room<U+2022> Stayed 7 nights<U+2022> Submitted via mobile",9.6,"¡°Great location and great facilities.¡±","Wi-Fi in the rooms would have been great Great location and great facilities The pool is awesome and the rooms are clean and comfyStayed in November "
