"","X","nationality","tags","score","content","content_detail"
"272",272,"Australia","<U+2022> Business trip<U+2022> Solo traveller<U+2022> Business King Room - Non-Smoking<U+2022> Stayed 1 night<U+2022> Submitted via mobile",10,"¡°Great choice for stop over.¡±"," Great location for stop over Super luxurious Stayed in October "
"273",273,"Australia","<U+2022> Leisure trip<U+2022> Couple<U+2022> Business King Room - Non-Smoking<U+2022> Stayed 1 night",10,"¡°Great hotel, would recommend.¡±"," We booked a room with runway views (for  night) that was quiet, spacious and clean  It had a luggage rack for both our suitcases  We had a lounge to sit on and a coffee table  The king bed was super comfy (the best bed on our  week trip)  The bathroom was large, the shower was hot and the pressure was good The breakfast was excellent with a huge variety for all tastesStayed in October "
"274",274,"Australia","<U+2022> Leisure trip<U+2022> Couple<U+2022> Business King Room - Non-Smoking<U+2022> Stayed 1 night<U+2022> Submitted via mobile",9.2,"¡°Crown plaza is our first choice when transiting through Singapore¡±","Had no issues the stay was as expected Good room size convenient access to the terminal  Great for a airport transit  Check in and checkout process has improved significantly since our last visit The MRT is at your doorstep if you want to go in to SingaporeStayed in October "
"275",275,"Australia","<U+2022> Leisure trip<U+2022> Couple<U+2022> Business King Room - Non-Smoking<U+2022> Stayed 1 night",9.2,"¡°An ""in transit"" stay¡±","a little pricey (drinks and food) proximity to airportStayed in October "
"276",276,"Australia","<U+2022> Leisure trip<U+2022> Family with young children<U+2022> Business King Room - Non-Smoking<U+2022> Stayed 1 night<U+2022> Submitted via mobile",9.2,"¡°Amazing convenience for overnight stay between flights.¡±","Food too expensive for quality Amazing convenience for overnight stay between flights Pool was excellent Stayed in October "
"277",277,"Singapore","<U+2022> Leisure trip<U+2022> Couple<U+2022> Business King Room - Non-Smoking<U+2022> Stayed 1 night<U+2022> Submitted via mobile",10,"¡°Proximity to airport cos I need to catch a flight out of...¡±"," Proximity to airport cos I need to catch a flight out of Singapore by amStayed in October "
"278",278,"Australia","<U+2022> Leisure trip<U+2022> Family with young children<U+2022> Business King Room - Non-Smoking<U+2022> Stayed 2 nights<U+2022> Submitted via mobile",9.6,"¡°Wish to stay longer¡±","NA Location location location!!!Stayed in October "
"279",279,"Australia","<U+2022> Leisure trip<U+2022> Family with young children<U+2022> Club Double Room - Non-Smoking<U+2022> Stayed 1 night<U+2022> Submitted via mobile",10,"¡°The club lounge¡±"," The club loungeStayed in October "
"280",280,"Australia","<U+2022> Leisure trip<U+2022> Couple<U+2022> Business King Room - Non-Smoking<U+2022> Stayed 1 night",10,"¡°Everything was really good food staff.¡±"," Everything was really good food staff Would like to thank Yoke for extra extra help I am disabled with a walking stick and we had four large cases and hand luggage she helped us to our room and offered to change our room closer to reception Thank you YokeStayed in October "
"281",281,"Australia","<U+2022> Leisure trip<U+2022> Couple<U+2022> Business King Room - Non-Smoking<U+2022> Stayed 1 night",9.6,"¡°met expectations¡±","expensive for simple night of accom fast efficient service  Everything worked  Easy to access flightsStayed in October "
"282",282,"Australia","<U+2022> Leisure trip<U+2022> Couple<U+2022> Business King Room - Non-Smoking<U+2022> Stayed 1 night",9.6,"¡°Perfect Location for a one night stop over¡±"," Bed was perfect Location suited us perfectStayed in October "
"283",283,"Australia","<U+2022> Leisure trip<U+2022> Couple<U+2022> Business King Room - Non-Smoking<U+2022> Stayed 1 night",9.2,"¡°o/nite stop on way home because of flight schedule. very comfortable¡±"," chinese restaurant excellentStayed in October "
"284",284,"Singapore","<U+2022> Business trip<U+2022> Couple<U+2022> Premier Double Room - Non-Smoking<U+2022> Stayed 1 night",8.8,"¡°Perfect location for the airport and good, helpful staff¡±","If you want a taxi it can be better to walk into the terminal and join the queue The staff were very helpful and the location is perfect for accessing all the airport terminals  The rooms were well designed for unpacking and repackingStayed in October "
"285",285,"United Kingdom","<U+2022> Leisure trip<U+2022> Couple<U+2022> Premier King Room with Runway View<U+2022> Stayed 1 night<U+2022> Submitted via mobile",7.1,"¡°Location¡±","Room probably not spacious enough LocationStayed in October "
"286",286,"Singapore","<U+2022> Leisure trip<U+2022> Group<U+2022> Premier Double Room - Non-Smoking<U+2022> Stayed 1 night<U+2022> Submitted via mobile",9.2,"¡°Nice place for transit¡±","Nothing Flexible check in time   Room are clean and big  Nice bathroom with bathtub Provide phone with data  able to easy go around city for tourist  Good location at  just outside airport N next to Train station Stayed in October "
"287",287,"United Kingdom","<U+2022> Leisure trip<U+2022> Family with young children<U+2022> Business King Room - Non-Smoking<U+2022> Stayed 1 night<U+2022> Submitted via mobile",10,"¡°Amazing¡±","Check in was busy Excellent value for facilities and location near airport Great rooms and lovely barStayed in October "
"288",288,"New Zealand","<U+2022> Leisure trip<U+2022> Solo traveller<U+2022> Business King Room - Non-Smoking<U+2022> Stayed 1 night<U+2022> Submitted via mobile",10,"¡°Room was excellent size and the free phone was a great idea...¡±","The temperature in the lifts to the accomodation floors was very hot!t use it for such a short stay)Stayed in October "
"289",289,"New Zealand","<U+2022> Leisure trip<U+2022> Couple<U+2022> Business King Room - Non-Smoking<U+2022> Stayed 1 night",8.3,"¡°The facilities were perfect for the overnight stop over.¡±","The concierge was meant to drop our bags off in our room whilst we went to dinner at the in-house restaurant When we got back from dinner, our bags were still sitting in reception - with no one watching them The facilities were perfect for the overnight stop over The restaurant on-site was also very nice and well pricedStayed in October "
"290",290,"India","<U+2022> Leisure trip<U+2022> Family with young children<U+2022> Business King Room - Non-Smoking<U+2022> Stayed 1 night",9.6,"¡°Superb property with world class facilities and standards¡±","All goodno complaints! Very comfy beds, very clean rooms, excellent location for transit and stay in Singapore Very well connected to public transport to city too Excellent amenities Very convenient if one's taking a short break at Singapore airport Hotel literally is at the airport !Stayed in October "
"291",291,"Australia","<U+2022> Leisure trip<U+2022> Family with young children<U+2022> Premier King Room with Pool View<U+2022> Stayed 1 night<U+2022> Submitted via mobile",8.8,"¡°Great location for short transit stop!!¡±","s really cold!!Stayed in October "
"292",292,"China","<U+2022> Leisure trip<U+2022> Family with young children<U+2022> Premier Twin Room - Non-Smoking<U+2022> Stayed 1 night",7.5,"¡°Perfect overnighter¡±"," Arrived very late at night with  children and was delighted that reception staff rushed us through and the extra bed was also all ready for us Perfect! Beds were super comfortable Very friendly breakfast staff Didn't get to see the facilities as was just an overnight stopStayed in September "
"293",293,"Singapore","<U+2022> Leisure trip<U+2022> Family with young children<U+2022> Business King Room - Non-Smoking<U+2022> Stayed 1 night<U+2022> Submitted via mobile",8.8,"¡°Planes¡±"," PlanesStayed in October "
"294",294,"Malaysia","<U+2022> Leisure trip<U+2022> Family with young children<U+2022> Premier Double Room - Non-Smoking<U+2022> Stayed 1 night",9.2,"¡°Nice stay¡±","No breakfast was provided as we were leaving very early The bed is very comfy, and I like the big roomStayed in September "
"295",295,"USA","<U+2022> Leisure trip<U+2022> Group<U+2022> Business King Room - Non-Smoking<U+2022> Stayed 1 night",10,"¡°Perfect for layover stay!¡±"," This hotel was super convenient for a night layover  It is walking distance, practically right inside the Singapore airport  Very convenient checkin, checkout  Super modern and clean rooms  Close to atm's and taxis!Stayed in October "
"296",296,"Australia","<U+2022> Leisure trip<U+2022> Couple<U+2022> Business King Room - Non-Smoking<U+2022> Stayed 1 night<U+2022> Submitted via mobile",10,"¡°Excellent! e<U+009F><U+0091><U+008C>¡±"," The view of the airport and the bathubStayed in September "
"297",297,"India","<U+2022> Leisure trip<U+2022> Couple<U+2022> Premier Double Room - Non-Smoking<U+2022> Stayed 1 night<U+2022> Submitted via mobile",7.5,"¡°Overall Fantastic¡±","The signage to reach the hotel wasnat mention to clear customs or immigrations , had to wait  hour for nothing  Coredr information is always a bonus  Room was perfect for the price with runway view and huge bathroom which is always good after a long journeyStayed in October "
"298",298,"Australia","<U+2022> Couple<U+2022> Business King Room - Non-Smoking<U+2022> Stayed 1 night<U+2022> Submitted via mobile",9.2,"¡°Comfortable overnight stay on the way to Europe.¡±","The false alarm emergency evacuation Comfortable bed and delicious foodStayed in October "
"299",299,"USA","<U+2022> Leisure trip<U+2022> Group<U+2022> Business King Room - Non-Smoking<U+2022> Stayed 1 night<U+2022> Submitted via mobile",10,"¡°I just love it¡±","Location NoneStayed in October "
"300",300,"Australia","<U+2022> Leisure trip<U+2022> Family with young children<U+2022> Premier Double Room - Non-Smoking<U+2022> Stayed 1 night<U+2022> Submitted via mobile",8.3,"¡°Fantastic location.¡±","Check in was a very slow process and as we didn't arrive until am with no sleep it seemed an unessesary process Quietness of roomStayed in September "
"301",301,"Singapore","<U+2022> Leisure trip<U+2022> Couple<U+2022> Business King Room - Non-Smoking<U+2022> Stayed 1 night<U+2022> Submitted via mobile",7.5,"¡°I will come again!¡±","A slight disappointment Is that the view could allow me to view plane And the air con was slightly or rather hot The service and the hospitality that all the staff have demonstrateStayed in October "
"302",302,"New Zealand","<U+2022> Leisure trip<U+2022> Solo traveller<U+2022> Business King Room - Non-Smoking<U+2022> Stayed 1 night",10,"¡°Excellent location, facilities and staff¡±","nothing Staff were so helpful and went out of their way to make my stay exceptionalStayed in October "
"303",303,"Australia","<U+2022> Leisure trip<U+2022> Solo traveller<U+2022> Business King Room - Non-Smoking<U+2022> Stayed 1 night",9.6,"¡°I had 19 hours layover in Singapore with a very early...¡±"," I had  hours layover in Singapore with a very early departure I was able to check in early Very quiet room, blockout curtains and lovely bath was just what I needed It is expensive but the convenience made it worthwhileStayed in September "
"304",304,"Brunei Darussalam","<U+2022> Leisure trip<U+2022> Couple<U+2022> Business King Room - Non-Smoking<U+2022> Stayed 2 nights",10,"¡°Perfect location for our one day trip to Singapore before...¡±"," Perfect location for our one day trip to Singapore before heading back home Convenience and very cleanStayed in October "
"305",305,"Brunei Darussalam","<U+2022> Leisure trip<U+2022> Solo traveller<U+2022> Business King Room - Non-Smoking<U+2022> Stayed 1 night",10,"¡°Convenient for early morning flight¡±"," It is convenient for our morning flight and easy to shop and grab some food at Changi It is really easy to go to the city with the MRT as wellStayed in September "
"306",306,"Turkey","<U+2022> Couple<U+2022> Business King Room - Non-Smoking<U+2022> Stayed 1 night<U+2022> Submitted via mobile",10,"¡°Location, facilitys, dinner, staff.¡±","Nothing Location, facilitys, dinner, staffStayed in October "
"307",307,"United Kingdom","<U+2022> Couple<U+2022> Business King Room - Non-Smoking<U+2022> Stayed 1 night<U+2022> Submitted via mobile",9.6,"¡°Comfortable accommodation, polite and pleasant staff, convenient location means relaxing stay.¡±","t need to travel further afieldStayed in October "
"308",308,"Australia","<U+2022> Leisure trip<U+2022> Couple<U+2022> Business King Room - Non-Smoking<U+2022> Stayed 2 nights<U+2022> Submitted via mobile",10,"¡°Wonderful staff, great location, luxurious surroundings,¡±","t see any signage at Terminal  to advise you had to get on the shuttle to get to the hotel located at terminal   Once we checked our confirmation email, and realised we had to get on the shuttle (you can take your luggage trolley on the shuttle) it was great Very close to train station so you can explore and get around SingaporeWith the Airport shuttle, you have stress  free travel options to get to all Airport  terminalsStayed in October "
"309",309,"Australia","<U+2022> Leisure trip<U+2022> Family with young children<U+2022> Business King Room - Non-Smoking<U+2022> Stayed 1 night<U+2022> Submitted via mobile",7.9,"¡°Beds were extremely comfortable¡±","Checked in after midnight as our flight had been delayed and staff on front desk was less then accomodating Had requested a late check out (pm- at extra cost of course) weeks earlier as only staying one night between flights, but was informed on arrival that they hadn't received notice of this as we had booked through a third party and could only stay til pm even though I had confirmation emails from both the hotel and bookingscom, staff wouldn't even look at the emails I tried to show her Tired already and travelling with our young son I wasn't going to argue and just needed a bed This however ruined our plans to spend the next day in Singapore Was only the next morning after I had filled in a survey about our stay that they told us we could have our original requested checkout at pm this was at am - as we figured we had to check out at pm, we would just stay in hotel til lunchtime and explore Changi airport before our next flight Too late still upset with lady on front desk who didn't even greet us or crack one smile (extremely poor customer service I have worked in customer service for over years) we checked out at  (less then hours in hotel $ for two rooms) hotel was fabulous just takes one staff member to ruin a guests experience and lose a customer Will not be staying here again because of it Beds were extremely comfortableStayed in September "
"310",310,"Australia","<U+2022> Leisure trip<U+2022> Couple<U+2022> Business King Room - Non-Smoking<U+2022> Stayed 1 night<U+2022> Submitted via mobile",10,"¡°We enjoyed our stay and will stay again to break our journey when travelling to a Europe.¡±","We had a snack in the bar but we're disappointed with the quality of the food  The wagu burger was disappointing Convenient location, our flight arrived late at night so it was good to just collect our bags and walk to the hotel  Room was very comfortable and quiet  Enjoyed relaxing by the pool the next dayStayed in October "
"311",311,"Thailand","<U+2022> Business trip<U+2022> Solo traveller<U+2022> Business King Room - Non-Smoking<U+2022> Stayed 1 night",9.6,"¡°Perfect place to re-charge my batteries before another long haul journey¡±","Finding the place for the first time  People in the airport were fairly vague about exactly where the Hotel was  So it took me about  minutes to find it  But as I said in the previous question, now that I know where it is, it will not be a problem in future Clean room, silent, everything worked  Could NOT hear neighbours, so a great stay all round  Now that I know where it is it will be easier to get to in future  It is a very convenient place to have a shower, have some sleep and then get some foodStayed in October "
"312",312,"Australia","<U+2022> Leisure trip<U+2022> Couple<U+2022> Business King Room - Non-Smoking<U+2022> Stayed 2 nights",10,"¡°This hotel was great for a stop over.¡±"," This hotel was great for a stop over We were able to sightsee easily from the Airport to visit Singapore city Our room was made available even though we were on a early flight, this was very much appreciatedStayed in October "
"313",313,"USA","<U+2022> Leisure trip<U+2022> Couple<U+2022> Business King Room - Non-Smoking<U+2022> Stayed 1 night<U+2022> Submitted via mobile",10,"¡°Perfect layover hotel.¡±","A little pricey but you can walk back to the terminal  downstairs and find some restaurants and a grocery store to save on food This hotel is so convenient for a layover  It is expensive but you can roll your airport trolley all the way to your room   No taxis, busses or trains to worry about   The restaurant has is good and when we were there there was as a special running cutting the price quite a bit   If you have time to go into the city there is a train you can catch right at the airport and it is much easier without your luggage   Especially nice for early morning departures  The rooms are really nice and the beds and pillows are so comfortableStayed in October "
"314",314,"Australia","<U+2022> Business trip<U+2022> Solo traveller<U+2022> Business King Room - Non-Smoking<U+2022> Stayed 1 night",9.2,"¡°An excellent and extremely comfortable airport hotel.¡±","There isn't much to fault Food and drink in the hotel is very expensive but it is easy to eat more cheaply in the airport (there is a good hawker centre in the basement of Terminal ) if you don't want to travel elsewhere The pool was good but a bit more greenery around the pool area would have been extra nice An excellent airport hotel Very quick to get to and very comfortable The room was very spacious and there was a big bath There was no noise at all in the room apart from the air conditioning - I didn't hear any aeroplane noise at all and was able to sleep well on my  hour stopover The air-conditioning didn't dry me out like as in many hotels and I felt very rested before taking my next flight It's only about $ and - min by taxi to Changi Village if you want a visit to a Hawker Centre for a cheap meal and a walk near the water The pool was also good to get some exercise and stretch out after being on a cramped planeStayed in October "
"315",315,"United Kingdom","<U+2022> Solo traveller<U+2022> Business King Room - Non-Smoking<U+2022> Stayed 1 night<U+2022> Submitted via mobile",9.2,"¡°Calming and a lot of support from intelligent and supportive staffmwho used thei iniative.¡±","For clients who want a snack rather than a larg meal a little more could be in offer Close proximity to the airport, helpful staff, good facilities in roomforStayed in October "
"316",316,"Australia","<U+2022> Leisure trip<U+2022> Group<U+2022> Business King Room - Non-Smoking<U+2022> Stayed 1 night<U+2022> Submitted via mobile",10,"¡°Best option for overnight stays with early morning flights¡±"," Amazing beds and pillows Super convenient to the airportStayed in October "
"317",317,"Singapore","<U+2022> Leisure trip<U+2022> Solo traveller<U+2022> King Suite - Non-Smoking<U+2022> Stayed 1 night<U+2022> Submitted via mobile",10,"¡°The place is vey convenient for me to get my things.¡±","Nothing  The place is vey convenient for me to get my things  Stayed in September "
"318",318,"United Kingdom","<U+2022> Leisure trip<U+2022> Couple<U+2022> Business King Room - Non-Smoking<U+2022> Stayed 1 night<U+2022> Submitted via mobile",8.8,"¡°Room was very comfortable  and clean.¡±","The view and noise werent great as there was a building job opposite our hotel room Room was very comfortable  and cleanstaff were very helpful Nice swimming pool areaStayed in October "
"319",319,"Japan","<U+2022> Leisure trip<U+2022> Family with young children<U+2022> Premier Double Room - Non-Smoking<U+2022> Stayed 1 night<U+2022> Submitted via mobile",6.7,"¡°Soso¡±","Before checking in, l propose to prepare and check the amenityStayed in October "
"320",320,"Australia","<U+2022> Leisure trip<U+2022> Solo traveller<U+2022> Business King Room - Non-Smoking<U+2022> Stayed 1 night",10,"¡°A wonderful experience!¡±"," The Staff in all areas of the Hotel were outstanding- at the front desk, in the Breakfast area, the Baggage collection and storage- all staff had a positive energy with good humour Very impressive!Stayed in October "
"321",321,"South Africa","<U+2022> Leisure trip<U+2022> Group<U+2022> Business King Room - Non-Smoking<U+2022> Stayed 1 night",10,"¡°Exellent stay and absolute value for money , especially after a long trip¡±"," We were on a flight from Dubai to Singapore and only landed at : terminal   After customs and luggage reclaim , we took the train to terminal  and within five minutes we arrived at the reception desk  There were a queue of about four people , but we were helped within two minutes  At that stage we were quite tired , but reception were very friendly and helpful  I booked two rooms ( Business King Room ) for me and my friend  The rooms were in a class of there own  In my opinion five star Stayed in September "
"322",322,"Australia","<U+2022> Leisure trip<U+2022> Couple<U+2022> Business King Room - Non-Smoking<U+2022> Stayed 1 night<U+2022> Submitted via mobile",8.8,"¡°Too short¡±","Nothing The hotel was situated at the airportA mobile phone was provided with unlimited international calls, so it came in handy to call the kids back homeIt skso had a great bath yo soak inStayed in October "
"323",323,"South Korea","<U+2022> Leisure trip<U+2022> Couple<U+2022> Premier Double Room - Non-Smoking<U+2022> Stayed 1 night",5.4,"¡°I like the location, pool, and breakfast of the hotel.¡±","There was sudden rain shower during my stay I was very surprised that the rain water was coming to my room through the main door Even my shoes were wet due to the infiltration of water I called the hotel desk to clean it, but the staff came after  min of my call Meanwhile, I could hear strange sound through the main door I opened the main door and found that the staff was fixing the ceiling of the corridor just in front of my room All these annoying things were happened about pm, which made me very uncomfortable I like the location, pool, and breakfast of the hotel It is very convenient from Chang i airport There are many shops in the land side of terminal  for dining and shopping The bed and shower rooms are also niceStayed in October "
"324",324,"Australia","<U+2022> Leisure trip<U+2022> Couple<U+2022> Premier Double Room - Non-Smoking<U+2022> Stayed 1 night<U+2022> Submitted via mobile",10,"¡°Convenient luxury at the airport¡±","Nothing The staff were very efficient and friendly - perfect for a stop overStayed in September "
"325",325,"Australia","<U+2022> Leisure trip<U+2022> Solo traveller<U+2022> Business King Room - Non-Smoking<U+2022> Stayed 1 night<U+2022> Submitted via mobile",10,"¡°Delightful and elegant hotel to stay in.¡±"," Courtesy and efficiency of all staffStayed in October "
"326",326,"Australia","<U+2022> Business trip<U+2022> Solo traveller<U+2022> Business King Room - Non-Smoking<U+2022> Stayed 1 night",9.2,"¡°The evening buffet meal was great value if you booked it at...¡±","Maybe late check outs are free or very cheap? The evening buffet meal was great value if you booked it at check in  - the room was very very comfortable and fitted out perfectly - it was expensive but then its proximity to the airport if you are staying only one night/between flights is what it is all aboutStayed in September "
"327",327,"Taiwan","<U+2022> Leisure trip<U+2022> Group<U+2022> Premier Double Room - Non-Smoking<U+2022> Stayed 1 night<U+2022> Submitted via mobile",7.1,"¡°The breakfast is diversity and delicious.¡±","They suddenly charged the hotel fee and didn't send me the message The fee is excluded % fee It should include all the fee in bookingcom Otherwise, it is hard to think the hotel is worthy or not The breakfast is diversity and deliciousStayed in October "
"328",328,"Australia","<U+2022> Business trip<U+2022> Solo traveller<U+2022> Business King Room - Non-Smoking<U+2022> Stayed 1 night",10,"¡°Refreshing¡±","The spa wasn't open when I was there, I would've loved a massage I think its operated by a third party so not really the hotel I had a  hour layover at Changi airport so decided to book into the hotel so I could rest properly, especially being pregnant This was the best travel decision I've ever made I slept in a bed, went and refreshed with a swim in the pool and then had a great bath in the room If I can book into a hotel like this I would deliberately book a long layover as the break in trip was just what I neededStayed in October "
"329",329,"Indonesia","<U+2022> Leisure trip<U+2022> Solo traveller<U+2022> Business King Room - Non-Smoking<U+2022> Stayed 1 night<U+2022> Submitted via mobile",7.5,"¡°Didn't  honour my Booking. Com reservation, scam¡±","Even book with  Bookingcom, the hotel didn't  honour the booking and charged me more money nearly  dollars more, please inform me how this can be and how I can get my rebate,  thank youStayed in October "
"330",330,"Australia","<U+2022> Business trip<U+2022> Solo traveller<U+2022> Premier Double Room - Non-Smoking<U+2022> Stayed 1 night",10,"¡°good¡±","Do not like the dark d All goodStayed in October "
"331",331,"Australia","<U+2022> Leisure trip<U+2022> Couple<U+2022> Business King Room - Non-Smoking<U+2022> Stayed 1 night",9.6,"¡°Quality and convenient¡±","Signage within airport could be improved So easy and convenient, especially with a am departure the next dayStayed in September "
