"","X","nationality","tags","score","content","content_detail"
"508",508,"Singapore","<U+2022> Leisure trip<U+2022> Family with young children<U+2022> Deluxe Adjoining Room<U+2022> Stayed 2 nights<U+2022> Submitted via mobile",7.1,"¡°Nice pool, comfy room¡±","Ants in the room, staff didn't make up the room (had to call up reception to request) Nice pool, comfy roomStayed in May "
"509",509,"Singapore","<U+2022> Leisure trip<U+2022> Couple<U+2022> Roof Garden Suite Queen<U+2022> Stayed 1 night<U+2022> Submitted via mobile",10,"¡°The view and the pool¡±"," The view and the poolStayed in April "
"510",510,"Malaysia","<U+2022> Leisure trip<U+2022> Family with young children<U+2022> Superior Double or Twin Room<U+2022> Stayed 1 night<U+2022> Submitted via mobile",8.3,"¡°Siloso beach resort a good choice.¡±","Just breakfast anything else were good We wish we can find rice/ fried rice or cereal for breakfast Breakfast foid were too simple Compare to the price of the hotelStayed in April "
"511",511,"Singapore","<U+2022> Leisure trip<U+2022> Solo traveller<U+2022> Superior Double or Twin Room<U+2022> Stayed 1 night<U+2022> Submitted via mobile",8.8,"¡°Good¡±","Small bathroomStayed in April "
"512",512,"South Africa","<U+2022> Leisure trip<U+2022> Couple<U+2022> Superior Double or Twin Room<U+2022> Stayed 4 nights",6.7,"¡°Hotel needs a complete overhaul¡±","We found that this property REALLY could use a major face lift  The hotel is run down & in need of lots of maintenance to return it to it's former glory  The location is lovely & the special needs staff are all wonderful  However, the buildings & rooms are old & in serious need of updating  The carpets in the lifts smell from people getting into the lift whilst they are wet - the hotel should consider removing the carpets  The whole hotel, right from reception needs an over haul  Also, if visitors are expecting a huge buffet spread for breakfast, they should perhaps book at another hotel as breakfast is very basic & does not cater to the western diet We found it admirable that hotel employs special needs staff & all the staff were absolutely lovely to deal withStayed in April "
"513",513,"Malaysia","<U+2022> Leisure trip<U+2022> Family with young children<U+2022> Superior Double or Twin Room<U+2022> Stayed 3 nights",10,"¡°Pool, Sun, and a view of the beach!¡±","Pool rocks are a little slippery Stayed on level , which is right in front of the pool! Watch out for the peacock roaming around the kids loved it! Make sure you grab a chance to go to the roof, and watch the boatsStayed in April "
"514",514,"Australia","<U+2022> Leisure trip<U+2022> Family with young children<U+2022> Deluxe Adjoining Room<U+2022> Stayed 3 nights<U+2022> Submitted via mobile",7.5,"¡°The rooms were a bit dated and in need of renovation soon as...¡±","The rooms were a bit dated and in need of renovation soon as the wallpaper was peeling and it was a bit oldStayed in April "
"515",515,"India","<U+2022> Leisure trip<U+2022> Couple<U+2022> Superior Double or Twin Room<U+2022> Stayed 1 night<U+2022> Submitted via mobile",7,"¡°Restaurant food¡±","Restaurant foodStayed in April "
"516",516,"Singapore","<U+2022> Leisure trip<U+2022> Group<U+2022> Deluxe Double or Twin Room<U+2022> Stayed 2 nights<U+2022> Submitted via mobile",3.8,"¡°I like the swimming pool.¡±"," It caught me by surprise that my booking charges stated in the email doesn't include service charge and tax I only realized when I checked in Most website will give the complete amount with everything included on the final figures so that I can do a proper comparison against other site But bookingcom omitted it out which display a lower figure This has hinder my decision making Not very honest  When I email to the hotel regards to the carpark facilities, I was only allow to park outside their hotel simply becoz I did not booked direct from them Only guest booked direct from them will be allow to park in their hotel on a first come first serve basis Their wifi is only available at common area such as level  n  There isn't any wifi available in the room The room is pretty old I booked for  nites, but the complimentary mineral water was only given in the room for  night Tv is so small Gosh! I have to sit infront of the bed to watch directly There is no power point available at the bedside table for hp charging I like the swimming poolStayed in April "
"517",517,"Singapore","<U+2022> Leisure trip<U+2022> Family with young children<U+2022> Deluxe Double or Twin Room<U+2022> Stayed 2 nights<U+2022> Submitted via mobile",7.1,"¡°eco friendly ...hotel that have special needs staff..thumbs up for that...but no wifi in the room¡±","no bathroben worse still no wifi in the roomst time going to hotel no wifi i like the soap in the bathroomStayed in April "
"518",518,"United Kingdom","<U+2022> Leisure trip<U+2022> Couple<U+2022> Superior Double or Twin Room<U+2022> Stayed 5 nights<U+2022> Submitted via mobile",8.3,"¡°Wonderfull Eco resort stay¡±","The rooms were clean and comfortable but very basic Lovely hotel with exceptionally friendly staff and a fabulous pool that makes you think you're in the middle of a rain forest with the lush vegetation and noisy cicadas The Eco tour of the site was very informative and it was wonderful to see so many young adults with special needs employed at the hotelStayed in April "
"519",519,"Singapore","<U+2022> Leisure trip<U+2022> Couple<U+2022> Superior Double or Twin Room<U+2022> Stayed 1 night<U+2022> Submitted via mobile",8.3,"¡°Nil¡±","Nil The place is quiet which is great! However I wish there were more varieties of food especially for breakfast and do keep track of the cleanliness of the plants infront of the food area Stayed in April "
"520",520,"United Arab Emirates","<U+2022> Leisure trip<U+2022> Couple<U+2022> Superior Double or Twin Room<U+2022> Stayed 2 nights<U+2022> Submitted via mobile",10,"¡°Relaxing¡±","No videt in bathroom AmbienceStayed in March "
"521",521,"Singapore","<U+2022> Leisure trip<U+2022> Family with young children<U+2022> Superior Double or Twin Room<U+2022> Stayed 2 nights",9.6,"¡°The bed was comfortable.¡±","The level of the TV will be better if can place higher The shower door was not good as water is flowing out nenaeth the shower glass door Not towel bar and hook to small to place the towel No small towel Tap water kept changing from hot to cold and cold to hot, need to keep adjust the tap when shower The bed was comfortable The placing of the switch was very good and easy to reach at nightStayed in April "
"522",522,"Singapore","<U+2022> Leisure trip<U+2022> Family with young children<U+2022> Superior Double or Twin Room<U+2022> Stayed 1 night<U+2022> Submitted via mobile",9.6,"¡°Great Anni spent with family.¡±"," Great spread of halal buffet Food  all around the corner Great entertainment n beachSuper friendly staffStayed in April "
"523",523,"Singapore","<U+2022> Leisure trip<U+2022> Family with young children<U+2022> Superior Double or Twin Room<U+2022> Stayed 2 nights",7.5,"¡°Cool location, nice crossiants and see squirrels, peacocks and walk to the beach every day!¡±","I did not like the sewage system of the bathroom, it seems that late at night, I can hear the water dripped drop by drop But once I fall asleep, I cannot hear it I like that the eco green initiatives of this resort and the perfect location of it as it's literally next to the beachStayed in April "
"524",524,"Australia","<U+2022> Leisure trip<U+2022> Family with young children<U+2022> Superior Double or Twin Room<U+2022> Stayed 2 nights",5.4,"¡°Would not stay here again although location was great and staff did their best.¡±","The rooms were very basic and in need of repair although the beds were very comfyFixtures and fittings were rusty with some hanging off the wall The whole place smelt damp with visable mould in the bathrooms Staff were extremely helpful Breakfast was good Pool was greatStayed in March "
"525",525,"Singapore","<U+2022> Leisure trip<U+2022> Family with young children<U+2022> Deluxe Double or Twin Room<U+2022> Stayed 1 night<U+2022> Submitted via mobile",6.3,"¡°Peace and quite hotel near the beach and surround by garden¡±","the room require renovation as it is getting old As such, the room charges should be cheaper Overall it is a good stay The garden concept is very goodStayed in April "
"526",526,"Malaysia","<U+2022> Leisure trip<U+2022> Family with young children<U+2022> Superior Double or Twin Room<U+2022> Stayed 1 night<U+2022> Submitted via mobile",7.1,"¡°Amazing hotel at affordable price¡±"," It's nature orientedStayed in April "
"527",527,"Singapore","<U+2022> Leisure trip<U+2022> Family with young children<U+2022> Superior Double or Twin Room<U+2022> Stayed 2 nights",2.5,"¡°The airconditioning at our room was really bad.¡±","The airconditioning at our room was really bad We did not fall asleep  at all on our first night as it was really hot! Our  year old daughter was crying non stop as she was not comfortable as well We called many times to report the issue The maintenance guy came around pm and checked the temperature and he did not even bother to talk to us He just kept on checking the room temperature for  to  minutes and left He said he will be back but he never came back We waited fo him tocome back I called the guest services again at around am and they just gave us a fan! I requested for a room change but unfortunately they asked us to wait until pm It was really a horrible service as they did not prioritize us the mere fact that we have a toddler with us They did not call us to check how was everything Until on our last day, we never received an update on the room change  We just survived our whole  days on the resort with a fan on the room! Honestly, it was a bad experience and we wont be returning to the resort or recommend it to anyone we know Nobody from the resort apologized for the inconvenience until the day we checked out And what worse was that we paid for the whole amount while all the time we stayed on the room that is not cool and with fan!Stayed in April "
"528",528,"Singapore","<U+2022> Leisure trip<U+2022> Family with young children<U+2022> Superior Double or Twin Room<U+2022> Stayed 1 night<U+2022> Submitted via mobile",2.5,"¡°book at your own risk¡±","too much to noteStayed in April "
"529",529,"Hong Kong","<U+2022> Leisure trip<U+2022> Family with young children<U+2022> Roof Garden Suite Queen<U+2022> Stayed 5 nights<U+2022> Submitted via mobile",8.3,"¡°Breakfast is nice with nature atmosphere.¡±"," Breakfast is nice with nature atmosphereStayed in April "
"530",530,"Malaysia","<U+2022> Leisure trip<U+2022> Family with young children<U+2022> Superior Double or Twin Room<U+2022> Stayed 3 nights<U+2022> Submitted via mobile",10,"¡°Like the resort being eco.¡±"," Like the resort being ecoStayed in April "
"531",531,"Singapore","<U+2022> Leisure trip<U+2022> Family with young children<U+2022> Superior Double or Twin Room<U+2022> Stayed 2 nights<U+2022> Submitted via mobile",7.1,"¡°Croissants tasted fresh on my 2nd morning breakfast!¡±"," Croissants tasted fresh on my nd morning breakfast! Saw peacocks around the premises too!Stayed in March "
"532",532,"Singapore","<U+2022> Leisure trip<U+2022> Family with young children<U+2022> Deluxe Double or Twin Room<U+2022> Stayed 1 night<U+2022> Submitted via mobile",8.8,"¡°We enjoyed so much for a night with family. The pool and the location by the beach is awesome.¡±","The breakfast has no proper selection like western Would loved to see alot of choices Loved the swimming pool and the staff are friendlyStayed in April "
"533",533,"Singapore","<U+2022> Leisure trip<U+2022> Family with young children<U+2022> Superior Double or Twin Room<U+2022> Stayed 1 night<U+2022> Submitted via mobile",6.3,"¡°Location¡±","Cleanliness of the room LocationStayed in April "
"534",534,"Singapore","<U+2022> Family with young children<U+2022> Superior Double or Twin Room<U+2022> Stayed 1 night<U+2022> Submitted via mobile",8.8,"¡°nice all¡±","No Comments Swimming pool, bear beach all over very niceStayed in March "
"535",535,"Singapore","<U+2022> Leisure trip<U+2022> Family with young children<U+2022> Roof Garden Suite Queen<U+2022> Stayed 2 nights<U+2022> Submitted via mobile",8.3,"¡°Wonderful getaway with your family¡±","The opened jacuzzi was not cleaned regularly The room airconditioning was good, the view at the jacuzzi was wonderfulStayed in April "
"536",536,"Singapore","<U+2022> Leisure trip<U+2022> Family with young children<U+2022> Deluxe Double or Twin Room<U+2022> Stayed 2 nights",8.3,"¡°Great family staycation¡±","mattress wasn't too comfy fantastic poolStayed in April "
"537",537,"Singapore","<U+2022> Family with young children<U+2022> Deluxe Double or Twin Room<U+2022> Stayed 1 night<U+2022> Submitted via mobile",6.7,"¡°Very convenience....¡±","Na Swimming pool and roof topStayed in April "
"538",538,"Singapore","<U+2022> Leisure trip<U+2022> Family with young children<U+2022> Superior Double or Twin Room<U+2022> Stayed 2 nights<U+2022> Submitted via mobile",7.5,"¡°Staff were friendly and helpful.¡±","Bed was uncomfortable Staff were friendly and helpfulStayed in April "
"539",539,"Singapore","<U+2022> Leisure trip<U+2022> Couple<U+2022> Superior Double or Twin Room<U+2022> Stayed 2 nights<U+2022> Submitted via mobile",6.7,"¡°Good for family. Will come back with kids¡±","No wifi in roomRoom Infested with ant Location ( right next to beach ) and the poolStayed in April "
"540",540,"New Zealand","<U+2022> Leisure trip<U+2022> Family with young children<U+2022> Superior Double or Twin Room<U+2022> Stayed 3 nights<U+2022> Submitted via mobile",7.5,"¡°pool was wonderful¡±","pillows and bed uncomfortable and shower changed temperature by itself pool was wonderfulStayed in April "
"541",541,"Singapore","<U+2022> Leisure trip<U+2022> Family with young children<U+2022> Superior Double or Twin Room<U+2022> Stayed 1 night<U+2022> Submitted via mobile",7.5,"¡°The environment.¡±","The bed is not good The environmentStayed in April "
"542",542,"Singapore","<U+2022> Leisure trip<U+2022> Family with young children<U+2022> Superior Double or Twin Room<U+2022> Stayed 1 night",7.5,"¡°Value for money¡±","The flash was a little stiff The kettle was rusty and changed twice Staff at counter could be a little more friendlyespecially cold during check out Value for moneyStayed in April "
"543",543,"Australia","<U+2022> Leisure trip<U+2022> Family with young children<U+2022> Superior Double or Twin Room<U+2022> Stayed 3 nights<U+2022> Submitted via mobile",7.1,"¡°Good location.¡±","Resort was a bit tired Good locationwasy access to all sentosa has to offerStayed in April "
"544",544,"India","<U+2022> Leisure trip<U+2022> Family with young children<U+2022> 2 rooms<U+2022> Stayed 2 nights<U+2022> Submitted via mobile",5,"¡°Not worth to book in more than $50¡±","Staff behaviourRoom clean up Breakfast was good Location was goodStayed in April "
"545",545,"Malaysia","<U+2022> Leisure trip<U+2022> Family with young children<U+2022> Superior Double or Twin Room<U+2022> Stayed 1 night<U+2022> Submitted via mobile",2.9,"¡°Not worth the money¡±","The wifi not available in rooms, less entertainment at night time for families with kids We loved the waterfallStayed in April "
"546",546,"Singapore","<U+2022> Couple<U+2022> Superior Double or Twin Room<U+2022> Stayed 1 night<U+2022> Submitted via mobile",6.7,"¡°The waterfall feature on the wall, spring water pool, lots...¡±","The very basic breakfast range,i felt like it was eating in a canteenAircon in room wasn't that cold even we set it to strong mode @  The waterfall feature on the wall, spring water pool, lots of greeneryGood view of beach/sea from room Kettle's hot plate was clean & spotlessHotel is cleanStayed in April "
"547",547,"Australia","<U+2022> Leisure trip<U+2022> Family with young children<U+2022> Superior Double or Twin Room<U+2022> Stayed 4 nights<U+2022> Submitted via mobile",7.5,"¡°The breakfast was only okay¡±","Nothing The breakfast was only okayStayed in March "
"548",548,"Australia","<U+2022> Business trip<U+2022> Group<U+2022> Superior Double or Twin Room<U+2022> Stayed 6 nights<U+2022> Submitted via mobile",6.7,"¡°Noisy but good cold air conditioning
¡±","Noisy but good cold air conditioningLow quality breakfastNumerous days housekeeping occurred end of day after my return to the room from day at workStayed in April "
"549",549,"Singapore","<U+2022> Leisure trip<U+2022> Group<U+2022> Superior Double or Twin Room<U+2022> Stayed 1 night<U+2022> Submitted via mobile",8.8,"¡°Overall it was an amazing stay! Loved it :)¡±","Can improve on the cleanliness part Food and drinks should be strictly banned from the pool area I liked the spring water pool althiugh it was a bit sandy compared to my previous visits Breakfast was good as usualStayed in April "
"550",550,"Singapore","<U+2022> Leisure trip<U+2022> Family with young children<U+2022> Superior Double or Twin Room<U+2022> Stayed 2 nights<U+2022> Submitted via mobile",8.8,"¡°Staycation¡±","Breakfast variety could have been betterRooms might need touching upStayed in March "
"551",551,"Hong Kong","<U+2022> Leisure trip<U+2022> Family with young children<U+2022> Superior Double or Twin Room<U+2022> Stayed 4 nights<U+2022> Submitted via mobile",4.2,"¡°Run down¡±","Hygiene & cleanliness was very poor Cleaner did not do their jobs properly & yet no supervisor to do the checking Eco accommodation doesn't mean that no maintenance needed There must have the basic standard of hygiene & cleanliness EnvironmentStayed in April "
"552",552,"USA","<U+2022> Business trip<U+2022> Family with young children<U+2022> Deluxe Adjoining Room<U+2022> Stayed 3 nights<U+2022> Submitted via mobile",6.7,"¡°Wonderful pool and waterfall¡±","The front desk staff gave me an incorrect invoice After  weeks I am still waiting for the correct invoice so that my job may reimburse me Please help!Stayed in March "
"553",553,"Singapore","<U+2022> Leisure trip<U+2022> Solo traveller<U+2022> 2 rooms<U+2022> Stayed 1 night<U+2022> Submitted via mobile",6.3,"¡°Pricey for the quality but good location.¡±","The toilets and room were too cramped up The natural spring swimming pool and waterfallStayed in March "
"554",554,"United Arab Emirates","<U+2022> Leisure trip<U+2022> Family with young children<U+2022> Superior Double or Twin Room<U+2022> Stayed 2 nights",7.5,"¡°Value for money¡±","Public areas were not that clean The restaurant is pretty basic  Limited choices for breakfast The location was really great Close to the beachStayed in March "
"555",555,"Singapore","<U+2022> Leisure trip<U+2022> Group<U+2022> Superior Double or Twin Room<U+2022> Stayed 1 night<U+2022> Submitted via mobile",7.5,"¡°A pleasant stay ...overall¡±","Would be good to provide a few hand towels I like the cleanliness of the bedsheets and comforterJacuzzi pool was amazingly lovelyStayed in April "
"556",556,"Brunei Darussalam","<U+2022> Leisure trip<U+2022> Group<U+2022> Superior Double or Twin Room<U+2022> Stayed 2 nights",7.5,"¡°Amazing place to stay for sand, sea and turf. Plenty of activities just a few steps away.¡±","No hot water in the shower I love the swimming pool and the location to the beach it was an amazing experience! Lots of activities to do, not an hour wasted had a great time soaking in the jacuzziStayed in March "
"557",557,"Singapore","<U+2022> Leisure trip<U+2022> Family with young children<U+2022> Deluxe Double or Twin Room<U+2022> Stayed 1 night",6.7,"¡°Great location, lovely pool but bad breakfast buffet!¡±","The choices of the breakfast buffet were not great at all The display were not great, everything was messy Some of the items were not available and was not replenished The room view was great and was comfortable The pool was very awesome! Location was great, it was near to shops, restaurants, beachStayed in March "
"558",558,"Singapore","<U+2022> Leisure trip<U+2022> Family with young children<U+2022> Superior Double or Twin Room<U+2022> Stayed 1 night<U+2022> Submitted via mobile",10,"¡°Good stay with family!¡±","The bathroom is quite small and the room wasn't sound proof We were happy because we got a free upgrade of the roomStayed in April "
"559",559,"Saudi Arabia","<U+2022> Leisure trip<U+2022> Family with young children<U+2022> Deluxe Double or Twin Room<U+2022> Stayed 3 nights<U+2022> Submitted via mobile",10,"¡°really good¡±","nothing i choose the hotel because it was the cheapest i found in the island but after staying for  night, i would recommend it to anybody  Stayed in April "
"560",560,"USA","<U+2022> Leisure trip<U+2022> Group<U+2022> Superior Double or Twin Room<U+2022> Stayed 1 night",9.6,"¡°SILOSO BEACH RESORT IS AWESOME!!¡±","WIfi in the room, a smoking room The pool/hot tubStayed in April "
"561",561,"Singapore","<U+2022> Leisure trip<U+2022> Group<U+2022> Roof Garden Suite Queen<U+2022> Stayed 1 night<U+2022> Submitted via mobile",4.6,"¡°A barely good experience¡±","Room: Fan and rooftop garden were dirty Room was not sound proof I can hear the musics from the beach clearly and hear people talking next doorExtra towel: At pm we asked for extra towel, instead of providing the normal white hotel towel, they provided us with the towel used for swimming pool visitorsReception area was quite small, it was quite crampy Merely just for the scenery and a short getaway with my girlfriends I am happy for the companyStayed in April "
"562",562,"United Kingdom","<U+2022> Leisure trip<U+2022> Family with young children<U+2022> Superior Double or Twin Room<U+2022> Stayed 5 nights<U+2022> Submitted via mobile",7.5,"¡°Lots of highs and lows¡±","I spent much of my time suffering the sound of constant drilling, hammering and then finally the fumes of paint and varnish in our room We should never have been placed so close to the rooms being renovated Lack of sleep and all round relaxation No wifi in the rooms and only sporadically throughout the hotel The hotel has lots to be proud of such as the Eco theme, the friendliness of the staff and their commitment to employing people with special needs Plus the pool and scenery were amazingStayed in April "
"563",563,"United Kingdom","<U+2022> Leisure trip<U+2022> Family with young children<U+2022> Superior Double or Twin Room<U+2022> Stayed 1 night<U+2022> Submitted via mobile",7.5,"¡°.¡±","No wifi in rooms Great pool within rainforest locationStayed in April "
"564",564,"Hong Kong","<U+2022> Leisure trip<U+2022> Family with young children<U+2022> Deluxe Double or Twin Room<U+2022> Stayed 2 nights<U+2022> Submitted via mobile",5.4,"¡°Locations¡±","Music from bars was too loud and played late into the night  over the weekend LocationsStayed in April "
"565",565,"India","<U+2022> Leisure trip<U+2022> Family with young children<U+2022> Deluxe Double or Twin Room<U+2022> Stayed 7 nights<U+2022> Submitted via mobile",6.7,"¡°Fun at sentosa¡±","Lengthy journey for singapore zoousd plus taxes was high for extra bed per night Pool and location for island activities was greatStayed in April "
"566",566,"United Kingdom","<U+2022> Leisure trip<U+2022> Couple<U+2022> Superior Double or Twin Room<U+2022> Stayed 2 nights<U+2022> Submitted via mobile",7.1,"¡°Nice stay but overpriced and not luxurious. Great if you are animal lover but very bad for internet¡±","Room very small No internet in most parts of hotel Shower light broken and not fixed No pictures on wall so room looked bare Room furniture very basic Reception area very small and not welcoming Overpriced and overrated on hotelscom I think  Hotel looked a little dated and in need of redecoration Around hotel areas looked unkept Fresh Spring water pool with swimming pool was great  Rooftop garden really lovely Very close to beach Gardens around hotel very beautiful Also hotel had a lot of wildlife including peacocks and squirrels and lots of birds very niceStayed in April "
"567",567,"China","<U+2022> Leisure trip<U+2022> Family with young children<U+2022> Superior Double or Twin Room<U+2022> Stayed 3 nights<U+2022> Submitted via mobile",9.6,"¡°good and value the for staycation ¡±","room aircon need to keep at very cool temperature which may not suitable for certain guest The housekeeping need to improve pool and near to beachStayed in April "
"568",568,"Singapore","<U+2022> Leisure trip<U+2022> Family with young children<U+2022> Superior Double or Twin Room<U+2022> Stayed 2 nights",7.5,"¡°Nice place to unwind surrounded by nature¡±","Access to hotel a bit far Besides, breakfast which was included (excellent by the way), dinner was a bit expensive Swimming pool was nice, the kids enjoy itStayed in April "
"569",569,"Singapore","<U+2022> Leisure trip<U+2022> Family with young children<U+2022> Superior Double or Twin Room<U+2022> Stayed 2 nights<U+2022> Submitted via mobile",8.3,"¡°Very close to Nature e<U+009F><U+008F><U+009E>e<U+009F><U+008F><U+009D>e<U+009F><U+008F><U+0096>¡±","Shower tube too short Love the nature of the resortStayed in March "
"570",570,"Singapore","<U+2022> Leisure trip<U+2022> Family with young children<U+2022> Superior Double or Twin Room<U+2022> Stayed 2 nights<U+2022> Submitted via mobile",7.5,"¡°The pool near the water slide are many dry leaves in it...¡±","The pool near the water slide are many dry leaves in it & no free wifi in the room(should provide free wifi in the room)Stayed in March "
